keyword	title	summary	content	url	date
삼성생명	삼성생명, 삼성전자 특별배당에 내재가치 개선…목표가↑-NH	"		[이데일리 이광수 기자] NH투자증권은 삼성생명(032830)에 대해 삼성전자 주가 상승과 특별배당 지급으로 내재가치가 개선될 것이라고 전망했다
정준섭 NH증권 연구원은 29일 “전날 삼성전자는 주당 1570원의 특별배당을 발표했다”며 “삼성전자 지분 8.51%를 가지고 있는 삼성생명은 올해 1분기 9818억원의 배당수익을 수취하게 될 전망”이라며 이같이 말했다
 그는 “삼성전자 특별배당은 사실상 일회성으로 봐야 한다”면서도 “낮은 자기자본이익률(ROE)로 고전하는 삼성생명 입장에서는 가뭄의 단비가 될 것”이라고 평가했다"	"		[이데일리 이광수 기자] NH투자증권은 삼성생명(032830)에 대해 삼성전자 주가 상승과 특별배당 지급으로 내재가치가 개선될 것이라고 전망했다
 목표가는 6만5000원에서 7만6000원으로 16.9% 상향했다
 다만 아직 생명보험 업황 개선을 기대하기 어려워 투자의견은 ‘Hold(보유)’를 유지했다
정준섭 NH증권 연구원은 29일 “전날 삼성전자는 주당 1570원의 특별배당을 발표했다”며 “삼성전자 지분 8.51%를 가지고 있는 삼성생명은 올해 1분기 9818억원의 배당수익을 수취하게 될 전망”이라며 이같이 말했다
 정 연구원은 “이를 포함해 삼성생명의 지배순이익은 작년보다 38.4% 증가한 1조5806억원이 예상된다”며 “이는 자연스럽게 올해 주당배당금(DPS) 상향으로 이어질 전망”이라고 말했다
 NH증권이 예상하는 삼성생명 DPS는 3500원이다
 그는 “삼성전자 특별배당은 사실상 일회성으로 봐야 한다”면서도 “낮은 자기자본이익률(ROE)로 고전하는 삼성생명 입장에서는 가뭄의 단비가 될 것”이라고 평가했다
 적어도 올해까지는 이원차 스프레드 개선을 기대하기 어려운 상황에서, 대규모 비이자수익은 이차 역마진에 대한 부담을 경감시켜 줄 것이라는게 정 연구원의 분석이다
 그는 “작년 4분기 삼성생명의 지배순이익은 1468억원을 기록할 것”이라며 “이는 전년 동기 대비(6억원)보다는 크게 늘지만 시장 전망치(1824억원)을 밑도는 수준”이라고 설명했다
 정 연구원은 “변액 보증준비금 적립 부담이 일부 발생할 것”이라며 “코로나19 반사이익으로 위험손해율은 전년 동기 대비 3.2%포인트 줄어든 81.5%로 개선될 것”이라고 밝혔다
삼성생명은 1957년 5월 동방생명으로 설립, 1963년 삼성그룹 편입됐다
 2019년 수입보험료 기준 시장점유율 24.1%로 1등 생명보험사다
이광수 (gs88@edaily
co
kr)▶ #24시간 빠른 #미리보는 뉴스 #eNews+▶ 네이버에서 '이데일리 뉴스'를 만나보세요▶ 빡침해소, 청춘뉘우스 '스냅타임'＜ⓒ종합 경제정보 미디어 이데일리 - 무단전재 & 재배포 금지＞"	https://news.naver.com/main/read.nhn?mode=LSD&mid=sec&sid1=101&oid=018&aid=0004840702	2021-01-29
삼성생명	변액보험 해지를 생각하는 가입자에게 [삼성생명 보험톡톡]	"		‘해지하면 손해’ 라는 것을 뻔히 알면서도 코로나19로 인한 소득 감소로 어쩔 수 없이 보험 계약을 해지하려는 가입자가 늘고 있다
그럼에도 불구하고 목돈이 필요해 해지를 고려하고 있다면 보험계약대출 등을 활용해 보는 것도 대안이 될 수 있다
 만약 장기 유지하고 있는 상품을 해약한다면 비용 측면에서 유리해진 상품을 해지하는 것이고 가입 초기 상품을 해약하게 된다면 비싼 비용을 먼저 부담한 상품을 해지하는 셈이 된다"	"		‘해지하면 손해’ 라는 것을 뻔히 알면서도 코로나19로 인한 소득 감소로 어쩔 수 없이 보험 계약을 해지하려는 가입자가 늘고 있다
 한편에서는 올들어 코스피 지수가 3000포인트를 넘고 미국 주가지수도 신고가를 갱신하면서 재테크 사이트 등에서는 직접 투자를 하기 위해 변액보험 중도 해지를 고민한다는 글도 증가하고 있다
 예금이나 펀드가 단거리·중거리 금융상품이라면 변액보험은 마라톤과 같다
 단기 수익률을 올리기 위해 해지를 고려한다면 그 전에 변액보험의 가입 목적을 다시 한번 되새겨 볼 필요가 있다
 변액보험도 기본적으로는 보험상품이기 때문에 보장이나 연금 수령 등의 목적을 가지고 있는 상품이다
 보험사는 이러한 목적 달성을 위해 사업비 등의 비용을 주로 보험료 납입기간에 차감한다
 납입이 끝난 시점부터는 비용에 대한 부담이 줄어드는 이유다
 만약 장기 유지하고 있는 상품을 해약한다면 비용 측면에서 유리해진 상품을 해지하는 것이고 가입 초기 상품을 해약하게 된다면 비싼 비용을 먼저 부담한 상품을 해지하는 셈이 된다
 수익률이 문제라고 한다면 변액보험 펀드변경 제도를 활용해 보면 어떨까
 상품에 따라서는 국내외 채권과 주식 등에 대해 다양한 국가와 스타일의 펀드로 변경이 가능하다
 수수료 등의 비용도 들지 않는다
 몇몇 보험사들은 소비자 편의를 위해 기존 상품에 대해서도 최근에 판매되고 있는 펀드들을 추가 선택할 수 있게 했다
 펀드 추천 서비스를 제공하기도 한다
그럼에도 불구하고 목돈이 필요해 해지를 고려하고 있다면 보험계약대출 등을 활용해 보는 것도 대안이 될 수 있다
삼성생명 정행용 보험운영실 프로▶ 경제지 네이버 구독 첫 400만, 한국경제 받아보세요▶ 한경 고품격 뉴스레터, 원클릭으로 구독하세요▶ 한국경제신문과 WSJ, 모바일한경으로 보세요 ⓒ 한국경제 & hankyung
com, 무단전재 및 재배포 금지	"	https://news.naver.com/main/read.nhn?mode=LSD&mid=sec&sid1=101&oid=015&aid=0004491648	2021-01-29
생명보험	"정희수 생명보험협회장 ""헬스케어 사업 지원해 신성장동력 확보"""	"28일 정희수 생명보험협회장은 비대면 기자간담회를 갖고 현재 생명보험업계가 처한 상황을 매우 엄중하고 긴박한 위기로 진단하고 향후 대응 방안을 제시했다
협회는 IFRS17(새국제회계기준)과 K-ICS(신지급여력제도)의 안정적 도입을 위한 제도적 기반을 마련하고, 고객의 신뢰 제고 및 지속성장을 위해 ESG 경영문화 확산을 선도하기로 했다
이를 위해 국민건강보험공단과 건강보험심사평가원의 가명처리된 보건의료데이터의 보험사 활용체계를 조속히 협의 및 확정하고, 금융위원회, 보건복지부 등 정부당국 및 유관기관과 국민건강보험법, 공공데이터법 등 관계법령 정비를 협의해 나갈 예정이다"	"생보협회 비대면 기자간담회 개최…""실손보험 청구 간소화 추진""정희수 생명보험협회장 [사진=생명보험협회][아이뉴스24 허재영 기자] 생명보험협회가 헬스케어사업 기반 마련 등 미래 성장동력 확보에 주력하겠다는 목표를 제시했다
 또한 디지털 혁신을 통해 변화를 선도하고, 실손보험 청구 간소화를 추진해 생명보험업계의 경영 여건 개선에도 나설 예정이다
28일 정희수 생명보험협회장은 비대면 기자간담회를 갖고 현재 생명보험업계가 처한 상황을 매우 엄중하고 긴박한 위기로 진단하고 향후 대응 방안을 제시했다
◆ 헬스케어 사업 영위 기반 마련…연금보험 세제 혜택 확대 추진생보협회는 헬스케어 사업 영위기반 마련 등 신성장동력 확충에 나선다
 생보사의 공공 보건의료데이터 이용 범위 확대를 추진해 보험가입자의 보험료 절감, 상품·서비스의 선택권 확대, 유병자·고령자 대상 보험시장 확대 등에 기여하기로 했다
이를 위해 국민건강보험공단과 건강보험심사평가원의 가명처리된 보건의료데이터의 보험사 활용체계를 조속히 협의 및 확정하고, 금융위원회, 보건복지부 등 정부당국 및 유관기관과 국민건강보험법, 공공데이터법 등 관계법령 정비를 협의해 나갈 예정이다
협회는 헬스케어 사업 기반 마련을 위해 ▲ 건강관리기기 금액한도 확대 등 '건강증진형 보험상품 개발․판매 가이드라인' 개정 건의 ▲ '비의료 건강관리서비스 가이드라인 및 사례집' 개정 건의 ▲ 민간제공 헬스케어에 대한 보건당국의 인증제 도입 지원 등을 통해 헬스케어 서비스의 상품화 등 관련 사업 영위를 위한 기반 마련을 추진하기로 했다
또한 금융위, 헬스케어산업, 생·손보업계가 공동 참여하는 '보험업권 헬스케어 활성화 TF'를 통해 헬스케어 서비스 확산을 가로막는 규제를 적극 발굴하고 개선방안을 마련할 계획이다
연금보험과 관련해서는 국민들의 연금상품 가입 확대를 위해 현행 개인연금과 퇴직연금을 합산해 700만원 한도인 연금보험의 세제혜택을 확대하는 방안을 검토해 세제당국에 건의할 예정이다
 해외 선진 연금제도를 벤치마킹해 국내 실정에 맞는 새로운 제도 도입도 추진하기로 했다
◆ 디지털 혁신으로 미래변화 선도…경영여건 개선 약속디지털 혁신도 핵심 과제로 꼽았다
 올해 모바일 청약절차의 도입 및 절차 간소화, 보험상담 및 보험가입설계 등의 업무에 AI(인공지능)기술 접목 및 활용 확대, 화상 앱을 활용한 비대면 영업 확대 등을 추진할 계획이다
보험심사 분야에서도 머신러닝 기반의 예측모델을 통한 자동 언더라이팅 및 즉시심사 역량강화, AI를 통한 고객안내장 검증 기능 확충, 인공지능 및 OCR(광학식 문자인식)을 통한 보험심사서류의 전산화 등을 업계와 공조해 확산해 나가기로 했다
생보업계 경영여건 개선을 위해 보험관련 법령 개정에도 나선다
 현재 답보 상태에 머물러 있는 실손의료보험 청구 간소화 도입을 위해 의료기관의 참여와 의료법 적용의 예외를 규정하는 보험업법 개정을 추진한다
공공 보건의료데이터 활용을 저해하는 데이터3법 하위 규제들을 발굴 및 정비해 법령개정을 건의하고, 보험사기방지 특별법 개정안도 국회에서 조속히 처리될 수 있도록 추진할 예정이다
또한 금융소비자보호법 개정을 통해 대형 GA(법인보험대리점)가 소비자에게 손해를 발생시킨 경우 1차 배상책임 부여로 보험사와 GA간 책임의 균형과 조화도 유도하기로 했다
협회는 IFRS17(새국제회계기준)과 K-ICS(신지급여력제도)의 안정적 도입을 위한 제도적 기반을 마련하고, 고객의 신뢰 제고 및 지속성장을 위해 ESG 경영문화 확산을 선도하기로 했다
 이를 위해 다음달 'ESG경영 공동 선포식'을 열 예정이다
정희수 회장은 ""생보업계는 과거 그 어느 때보다도 심각하게 어려운 상황에 직면해 있다""며 ""뼈를 깎는 자세로 생보업계의 경영위기 타개를 위해 최선의 노력을 다해 나갈 것이다""고 말했다
허재영기자 huropa@inews24.com▶네이버 채널에서 '아이뉴스24'를 구독해주세요
▶재밌는 아이뉴스TV 영상보기 ▶아이뉴스24 바로가기[ⓒ 아이뉴스24 무단전재 및 재배포 금지]"	https://news.naver.com/main/read.nhn?mode=LSD&mid=sec&sid1=101&oid=031&aid=0000581460	2021-01-29
생명보험	변액보험 해지를 생각하는 가입자에게 [삼성생명 보험톡톡]	" 몇몇 보험사들은 소비자 편의를 위해 기존 상품에 대해서도 최근에 판매되고 있는 펀드들을 추가 선택할 수 있게 했다
		‘해지하면 손해’ 라는 것을 뻔히 알면서도 코로나19로 인한 소득 감소로 어쩔 수 없이 보험 계약을 해지하려는 가입자가 늘고 있다
 만약 장기 유지하고 있는 상품을 해약한다면 비용 측면에서 유리해진 상품을 해지하는 것이고 가입 초기 상품을 해약하게 된다면 비싼 비용을 먼저 부담한 상품을 해지하는 셈이 된다"	"		‘해지하면 손해’ 라는 것을 뻔히 알면서도 코로나19로 인한 소득 감소로 어쩔 수 없이 보험 계약을 해지하려는 가입자가 늘고 있다
 한편에서는 올들어 코스피 지수가 3000포인트를 넘고 미국 주가지수도 신고가를 갱신하면서 재테크 사이트 등에서는 직접 투자를 하기 위해 변액보험 중도 해지를 고민한다는 글도 증가하고 있다
 예금이나 펀드가 단거리·중거리 금융상품이라면 변액보험은 마라톤과 같다
 단기 수익률을 올리기 위해 해지를 고려한다면 그 전에 변액보험의 가입 목적을 다시 한번 되새겨 볼 필요가 있다
 변액보험도 기본적으로는 보험상품이기 때문에 보장이나 연금 수령 등의 목적을 가지고 있는 상품이다
 보험사는 이러한 목적 달성을 위해 사업비 등의 비용을 주로 보험료 납입기간에 차감한다
 납입이 끝난 시점부터는 비용에 대한 부담이 줄어드는 이유다
 만약 장기 유지하고 있는 상품을 해약한다면 비용 측면에서 유리해진 상품을 해지하는 것이고 가입 초기 상품을 해약하게 된다면 비싼 비용을 먼저 부담한 상품을 해지하는 셈이 된다
 수익률이 문제라고 한다면 변액보험 펀드변경 제도를 활용해 보면 어떨까
 상품에 따라서는 국내외 채권과 주식 등에 대해 다양한 국가와 스타일의 펀드로 변경이 가능하다
 수수료 등의 비용도 들지 않는다
 몇몇 보험사들은 소비자 편의를 위해 기존 상품에 대해서도 최근에 판매되고 있는 펀드들을 추가 선택할 수 있게 했다
 펀드 추천 서비스를 제공하기도 한다
그럼에도 불구하고 목돈이 필요해 해지를 고려하고 있다면 보험계약대출 등을 활용해 보는 것도 대안이 될 수 있다
삼성생명 정행용 보험운영실 프로▶ 경제지 네이버 구독 첫 400만, 한국경제 받아보세요▶ 한경 고품격 뉴스레터, 원클릭으로 구독하세요▶ 한국경제신문과 WSJ, 모바일한경으로 보세요 ⓒ 한국경제 & hankyung
com, 무단전재 및 재배포 금지	"	https://news.naver.com/main/read.nhn?mode=LSD&mid=sec&sid1=101&oid=015&aid=0004491648	2021-01-29
생명보험	[포토]신한생명보험, '생명보험협회장상 수상'	"[이데일리 노진환 기자] 2021 이데일리 대한민국 금융소비자대상 시상식이 28일 오후 서울 중구 통일로 KG타워 하모니홀에서 열렸다
kr)▶ #24시간 빠른 #미리보는 뉴스 #eNews+▶ 네이버에서 '이데일리 뉴스'를 만나보세요▶ 빡침해소, 청춘뉘우스 '스냅타임'＜ⓒ종합 경제정보 미디어 이데일리 - 무단전재 & 재배포 금지＞
 정희수(왼쪽) 생명보험협회장과 생명보험협회장상을 수상한 유희창 신한생명보험 상무가 기념촬영을 하고 있다"	"[이데일리 노진환 기자] 2021 이데일리 대한민국 금융소비자대상 시상식이 28일 오후 서울 중구 통일로 KG타워 하모니홀에서 열렸다
 정희수(왼쪽) 생명보험협회장과 생명보험협회장상을 수상한 유희창 신한생명보험 상무가 기념촬영을 하고 있다
노진환 (shdmf@edaily
co
kr)▶ #24시간 빠른 #미리보는 뉴스 #eNews+▶ 네이버에서 '이데일리 뉴스'를 만나보세요▶ 빡침해소, 청춘뉘우스 '스냅타임'＜ⓒ종합 경제정보 미디어 이데일리 - 무단전재 & 재배포 금지＞"	https://news.naver.com/main/read.nhn?mode=LSD&mid=sec&sid1=101&oid=018&aid=0004840273	2021-01-29
생보사	"""헬스케어 등 미래성장동력 육성"""	"정희수 생명보험협회장 간담회""ESG 경영 강화도 적극 추진""  정희수 생명보험협회장(사진)은 28일 ""공공 보건의료데이터 이용 확대와 헬스케어 사업 확대 등 생명보험산업의 미래성장 동력 육성을 위해 적극 나서겠다""고 밝혔다
   정 회장은 이날 비대면 기자간담회에서 현재 생명보험업계가 처한 상황을 매우 엄중하고 긴박한 위기로 진단하면서 위기 극복 방안을 제시했다
   헬스케어 서비스를 넘어 헬스케어 산업으로 확대, 미래성장동력으로 키워야 한다는 게 정 회장의 지론이다"	"정희수 생명보험협회장 간담회""ESG 경영 강화도 적극 추진""  정희수 생명보험협회장(사진)은 28일 ""공공 보건의료데이터 이용 확대와 헬스케어 사업 확대 등 생명보험산업의 미래성장 동력 육성을 위해 적극 나서겠다""고 밝혔다
   헬스케어 서비스를 넘어 헬스케어 산업으로 확대, 미래성장동력으로 키워야 한다는 게 정 회장의 지론이다
 또한 그는 연금시장 활성화를 위해 연금보험 세제 혜택 등 제도 개선을 추진하고, 보험업계의 ESG 경영 확산에도 기여한다는 방침이다
   정 회장은 이날 비대면 기자간담회에서 현재 생명보험업계가 처한 상황을 매우 엄중하고 긴박한 위기로 진단하면서 위기 극복 방안을 제시했다
   우선 그는 생보사의 공공 보건의료데이터 이용 확대를 제시했다
 생보사의 공공 보건의료데이터 이용 범위 확대를 추진해 △보험가입자의 보험료 절감 △상품·서비스의 선택권 확대 △유병자·고령자 대상 보험시장 확대 등에 기여한다는 방침이다
   이를 위해 국민건강보험공단·건강보험심사평가원의 가명처리된 보건의료데이터의 보험사 활용체계를 협의·확정하기로했다
 동시에 금융위, 보건복지부 등 정부당국 및 유관기관과 함께 관계법령 정비를 협의해 나가기로 했다
   정 회장은 ""개인정보보호법 개정으로 산업적 연구 목적의 가명정보 활용이 가능함에도 건보공단, 심평원 등은 보험사에 대해 보건의료 가명정보를 개방하지 않고 있다""면서 ""국민 편익 증진과 생보산업의 혁신성장 기반 마련을 위해 금융위, 복지부 및 유관기관 등과 지속적인 협의 추진할 것""이라고 설명했다
   헬스케어 사업 확대 지원도 중점 추진 과제 중 하나로 꼽았다
   선진국의 경우 헬스케어가 상품화돼 생보사에서 운용되고 있음에도 국내에서는 비의료행위 제한 등 엄격한 규제가 상존해 활성화가 어려운 상황이다
   그는 ""헬스케어 산업 확대를 위해 적극적인 규제완화를 건의하고 시장 활성화 기반 마련을 통해 헬스케어 서비스의 상품화, 건강증진형 보험상품과 연계 등을 추진할 것""이라고 설명했다
   사적연금 시장 활성화를 위해 현행 개인연금+퇴직연금 합산 700만원 한도인 연금보험의 세제혜택을 확대하는 방안을 세제당국에 건의키로 했다
   아울러 디지털 혁신과 관련, 보험 모집채널은 물론 보험심사 분야에서의 디지털 혁신을 지원하고 실손의료보험 청구 간소화 도입, 데이터3법 후속 제도 개선, 금융소비자보호법 개정 등 시대변화를 반영한 보험관련 법령 개정도 추진한다는 방침이다
   이외에 ESG 경영문화 확산을 통해 소비자 신뢰 제고에 나선다는 계획이다
 그일환으로 생보협회는 다음달 보험업계 CEO와 함께 'ESG경영 공동 선포식'을 갖고 ESG 경영문화를 확산시키는 전기를 마련한다
    hsk@fnnews
com 홍석근 기자 ▶ 헉! 소리나는 스!토리 뉴스 [헉스]▶ '아는 척'하고 싶은 당신을 위한 [두유노우]▶ 날로먹고 구워먹는 금융이슈 [파인애플]  ※ 저작권자 ⓒ 파이낸셜뉴스
 무단 전재-재배포 금지	"	https://news.naver.com/main/read.nhn?mode=LSD&mid=sec&sid1=101&oid=014&aid=0004574457	2021-01-29
금융위원회	[포토]2021 이데일리 대한민국 금융소비자대상, '축사하는 최훈 금융위원회 상...	"[이데일리 노진환 기자] 2021 이데일리 대한민국 금융소비자대상 시상식이 28일 오후 서울 중구 통일로 KG타워 하모니홀에서 열렸다
co
kr)▶ #24시간 빠른 #미리보는 뉴스 #eNews+▶ 네이버에서 '이데일리 뉴스'를 만나보세요▶ 빡침해소, 청춘뉘우스 '스냅타임'＜ⓒ종합 경제정보 미디어 이데일리 - 무단전재 & 재배포 금지＞"	"[이데일리 노진환 기자] 2021 이데일리 대한민국 금융소비자대상 시상식이 28일 오후 서울 중구 통일로 KG타워 하모니홀에서 열렸다
 최훈 금융위원회 상임위원이 축사를 하고 있다
노진환 (shdmf@edaily
co
kr)▶ #24시간 빠른 #미리보는 뉴스 #eNews+▶ 네이버에서 '이데일리 뉴스'를 만나보세요▶ 빡침해소, 청춘뉘우스 '스냅타임'＜ⓒ종합 경제정보 미디어 이데일리 - 무단전재 & 재배포 금지＞"	https://news.naver.com/main/read.nhn?mode=LSD&mid=sec&sid1=101&oid=018&aid=0004840280	2021-01-29
