keyword	title	summary	content	url
실손보험	스치기만 해도 드러눕는 20%가 내차 보험료 올린다	" 교통사고로 입원 중이던 국내 31번째 확진 환자를 계기로 지역 감염이 확산하면서 병원 입원 자체를 꺼린 데다 나이롱 환자에 대한 부정적인 인식도 커져서다
 사회적 거리두기 영향으로 자동차를 이용한 여행이나 장거리 이동이 감소했기 때문이다
 경미사고로 인한 보험금 누수의 실태와 문제점을 짚어보고, 제도개선 방안을 찾아본다"	"		[머니투데이 전혜영 기자] [편집자주] 코로나19로 인한 사회적 거리두기 효과로 교통사고 건수가 줄었다
 그럼에도 자동차보험은 여전히 적자상태를 면치 못한다
 가벼운 교통사고를 당한 경상환자의 과잉진료 등으로 인해 사고당 평균 보험금은 오히려 늘어서다
 경미사고로 인한 보험금 누수의 실태와 문제점을 짚어보고, 제도개선 방안을 찾아본다
 [[나이롱환자가 올리는 차보험료]<상>-①경미사고 80%는 보험처리 안해, 20%가 '문콕' 사고로 과잉진료, 보험금 누수 심각] 지난해 코로나19(COVID-19)가 확산하면서 교통사고 건수가 크게 줄었다
 사회적 거리두기 영향으로 자동차를 이용한 여행이나 장거리 이동이 감소했기 때문이다
 보험회사들은 뜻밖의 '코로나 반사이익'으로 지난해 자동차보험의 손해율(받은 보험료 대비 지급한 보험금 비율)이 개선될 것으로 기대했다
 하지만 지난해에도 자동차보험은 적자를 벗어나지 못했다
◇코로나도 못 잡은 나이롱 환자지난해 상반기만 해도 코로나19가 전국으로 확대되면서 보험금을 타낼 목적으로 입원하는 가짜 환자, 이른바 '나이롱 환자'가 눈에 띄게 줄어들었다
 교통사고로 입원 중이던 국내 31번째 확진 환자를 계기로 지역 감염이 확산하면서 병원 입원 자체를 꺼린 데다 나이롱 환자에 대한 부정적인 인식도 커져서다
 하지만 일시적 현상에 불과했다
 코로나19 사태가 장기화하자 나이롱 환자들이 다시 병원으로 몰려왔다
지난해 일 평균 사고건수는 1만9402건으로 전년(2만1283건) 대비 8.8% 감소했다
 반면 같은 기간 사고당 평균보험금(대인)은 270만원에서 299만원으로 10.7% 증가했다
 사고가 줄었어도 과잉진료 등으로 보험금은 늘어난 것이다
특히 경미한 사고를 당한 경상환자에게 지급되는 보험금이 걷잡을 수 없이 커지고 있다
 보험개발원에 따르면 경미한 사고는 △차량 투명 코팅막만 벗겨진 손상 △투명 코팅막과 색상이 동시에 벗겨진 손상 △도장막과 외판소재의 손상 등으로 분류된다
 이런 유형의 사고가 나면 당사자의 80% 가량은 보험 접수 조차하지 않고 지나간다
 하지만 소수에 해당하는 20%가 병원으로 달려가 보험금을 타낸다
 병원에서 진료를 받았지만 특별한 의사의 소견이 없어 진단서를 제출하지 않은 경상환자들은 상해 급수 상 가장 낮은 14급으로 처리한다
 2019년 기준 14급에 해당하는 경상환자 비중은 전체 부상환자의 약 74.5%를 차지한다
 이들에게 지급된 보험금은 1조8792억원으로 전체 보험금(4조1860억원)의 44.9%에 이른다
 진단서조차 나오지 않는 환자들에게 보험금 절반 가량이 지급된 셈이다
전용식 보험연구원 연구위원은 ""보통 진단 3주 이하의 사고를 경미사고로 간주한다""며 ""일부 경상환자들이 상해 여부나 치료종결 여부에 대한 객관적인 입증이 어렵다는 점을 악용해 부당하게 보험금을 청구했을 가능성이 있다""고 말했다
 ◇한방진료비 전액 다 내주는 '구멍난' 자동차보험경상환자들은 양방병원보다 한방병원을 선호한다
 그렇다 보니 교통사고 환자의 한방진료비는 매년 20~30% 급증세다
 총 진료비 대비 한방진료 비중은 2017년만 해도 31.3%에 그쳤지만 지난해에는 3분기 기준 46.4%로 늘었다
 교통사고 환자 두 명 중 한 명 꼴이다
국민건강보험과 실손의료보험은 병원에서 진료를 받을 때 환자에게 본인부담금을 부과하지만 자동차보험은 본인부담금이 전혀 없다
 급여뿐 아니라 건강보험이 보장하지 않는 비급여 진료까지 모두 보상한다
 자동차가 막 보급되기 시작한 1970년대 말 주로 자동차와 사람 사이 사고가 많았기 때문에 피해자 보상을 위해 만들어진 제도가 40년이 지나도록 제자리다
특히 한병병원은 일부 한방전용보험을 제외하곤 자동차보험에서만 보장해준다
 자동차사고로 한방병원에서 치료를 받게 되면 비급여 진료로 분류되는 첩약, 약침, 한방물리요법 등을 한 푼의 자기 부담 없이 자동차보험을 통해 받을 수 있다
2019년 기준 경상환자(상해급수 12~14급)의 1인당 평균 한방 진료비는 약 76만원으로 평균 양방 진료비(약 32만원)의 2배가 넘는다
 한방 외래(통원) 진료일수도 8.95일로 양방(5.47일)에 비해 약 1.6배 많았다
 일부 한방병원들이 '교통사고 환자 모시기'에 공을 들인 결과 교통사고 한방진료비는 2015년 이후 매년 1000억원 넘게 증가한다
경상환자 유치가 새 수익원으로 부상하자 한방병원 개수도 눈에 띄게 늘고 있다
 전국 한방병원은 2012년 181개에서 2017년 311개가 되더니 2020년 9월 현재에는 400여개에 이른다
 의료계 한 관계자는 ""10여년 전 한의사 공급 과잉과 홍삼 등 건강기능식품의 급성장으로 존폐의 위기를 겪던 한의업계가 자동차보험 경상환자를 유치하면서 살아났다는 말이 나올 정도로 매출에 차지하는 비중이 절대적""이라고 말했다
전혜영 기자 mfuture@mt
co
kr▶부동산 투자는 [부릿지]▶조 변호사의 가정상담소▶줄리아 투자노트 <저작권자 ⓒ '돈이 보이는 리얼타임 뉴스' 머니투데이, 무단전재 및 재배포 금지>	"	https://news.naver.com/main/read.nhn?mode=LSD&mid=sec&sid1=101&oid=008&aid=0004534471
실손보험	유병자실손보험 인기…2년 만에 350% 성장	" 금융당국이 과거 질병 치료 이력이 있어 실손보험 가입을 거절당했던 소비자들을 위해 마련했다
손보 ‘빅4’ 작년 1~9월 실적분석1인당 月 4만원…심사강화 전망사각지대 해소를 위해 금융당국이 내놓은 정책상품인 유병력자 실손의료보험 시장이 출시 2년여만에 350% 성장했다
25일 헤럴드경제가 손해보험업계에서 입수한 자료에 따르면 삼성화재·현대해상·KB손해보험·DB손해보험 4개사가 지난해 1~9월 걷은 유병자 실손보험의 원수보험료는 총 841억5400만원으로 집계됐다"	"손보 ‘빅4’ 작년 1~9월 실적분석1인당 月 4만원…심사강화 전망사각지대 해소를 위해 금융당국이 내놓은 정책상품인 유병력자 실손의료보험 시장이 출시 2년여만에 350% 성장했다
25일 헤럴드경제가 손해보험업계에서 입수한 자료에 따르면 삼성화재·현대해상·KB손해보험·DB손해보험 4개사가 지난해 1~9월 걷은 유병자 실손보험의 원수보험료는 총 841억5400만원으로 집계됐다
 유병자 실손보험이 처음 출시된 해인 2018년 3분기 188억2900만원 대비 347% 성장했다
같은 기간 가입자 수도 급증했다
 이들 4개사의 보유계약건수는 2018년 10만1778건에서 작년 26만7611건으로 163% 늘었다
 1인당 월평균 보험료는 약 4만원 수준이다
유병자 실손보험은 지난 2018년 4월 처음 출시됐다
 금융당국이 과거 질병 치료 이력이 있어 실손보험 가입을 거절당했던 소비자들을 위해 마련했다
 정부가 주도했다는 점에서 소방관보험, 맹견보험 등과 같은 정책성 보험으로 분류된다
시장 예상을 뒤엎는 흥행 실적이다
 유병자 실손보험과 유사한 노후실손보험의 실패와는 대비된다
 2014년 고령층 고객을 위해 금융당국이 만들었지만 질병 등을 사유로 번번이 가입이 가로 막혔기 때문이다
 지난해까지 약 4년 간 총 3만건도 팔리지 않았다
보험사 입장에서도 블루오션을 잡는 데 일부 성과를 거뒀다는 평가가 나온다
 이미 실손보험 가입자는 3800만명에 이를 정도로 대다수 국민이 가입하고 있어 성장성에 한계가 있었다
 하지만 이번 유병자 실손보험을 통해 질병 때문에 가입하지 못했던 중장년층 고객을 포섭하며 높은 매출을 올리는 데 성공했다
기존 실손보험의 실패 사례를 따르지 않기 위해 손해율 관리에도 적극적이다
 유병자 실손보험의 진료비 자기부담률은 30% 수준으로 일반 실손보험 10~20% 대비 높다
 과잉 의료 이용을 막는 장치다
 보험료도 일반 실손보험보다 2~3배가량 비싸다
 최근에는 높아진 실손보험의 손해율을 관리하기 위해 가입 심사를 강화하는 추세다
향후 유병자 실손보험은 지속적인 성장세를 보일 전망이다
정성희 보험연구원 실장은 “유병자 실손보험이 노후실손보험의 단점을 보완하며 가입자를 늘리고 있다”며 “고령화 추세에 맞춰 유병자 또한 증가해 보험 수요가 증가할 것”이라고 전망했다
 정경수 기자▶환경적 대화기구 '헤럴드에코'▶밀리터리 전문 콘텐츠 ‘헤밀’▶헤럴드경제 네이버 채널 구독- Copyrights ⓒ 헤럴드경제 & heraldbiz
com, 무단 전재 및 재배포 금지 -	"	https://news.naver.com/main/read.nhn?mode=LSD&mid=sec&sid1=101&oid=016&aid=0001783986
실손보험	광진구민 생활안전보험 가입…최대 200만 원 보상	" 피해자 과실 유무 상관없이 상해 직접결과로 발생한 사고의료비용 보상[아시아경제 박종일 기자] 광진구(구청장 김선갑)가 예기치 못한 각종 안전사고로부터 피해를 입은 구민에게 생활안정과 피해보상을 위한 제도적 장치를 마련하기 위해 구민생활안전보험에 가입했다
대다수 자치구에서 시행하고 있는 사망, 후유장애에 대한 위로금 형태의 정액형 보장이 아닌 사고의료비를 보장, 구민이 실생활에 더 도움이 될 수 있도록 마련했다
보장내용은 피해자의 과실 유무를 불문, 상해의 직접결과로 발생한 장례 및 응급비용, 치료, 수술, X선검사, 치과치료, 입원 등에 대한 의료비용이며, 보장한도는 1인 당 최대 200만 원(매 청구당 3만 원 공제)내에서 보상한다"	"별도 가입절차 없이 광진구민이라면 누구나 2월부터 자동가입


 피해자 과실 유무 상관없이 상해 직접결과로 발생한 사고의료비용 보상[아시아경제 박종일 기자] 광진구(구청장 김선갑)가 예기치 못한 각종 안전사고로부터 피해를 입은 구민에게 생활안정과 피해보상을 위한 제도적 장치를 마련하기 위해 구민생활안전보험에 가입했다
구는 지난해부터  생활안전보험 시행을 위해 구민생활안전보험 운영 조례를 제정, 서울시 시민안전보험과 중복되지 않도록 검토해왔다
대다수 자치구에서 시행하고 있는 사망, 후유장애에 대한 위로금 형태의 정액형 보장이 아닌 사고의료비를 보장, 구민이 실생활에 더 도움이 될 수 있도록 마련했다
광진구 생활안전보험은 관내에 주민등록을 둔 모은 구민이면 누구나 자동으로 가입되며 2월1일부터 혜택을 받을 수 있다
 또 개별적으로 가입한 실손의료보험과 중복지급이 가능, 보험가입 기간 중(광진구 거주 기간) 발생한 사고라면 발생일로부터 3년 내 보험청구 할 수 있다
보장내용은 피해자의 과실 유무를 불문, 상해의 직접결과로 발생한 장례 및 응급비용, 치료, 수술, X선검사, 치과치료, 입원 등에 대한 의료비용이며, 보장한도는 1인 당 최대 200만 원(매 청구당 3만 원 공제)내에서 보상한다
 다만, 질병으로 인한 의료비, 교통사고, 산업재해, 자전거 및 개인형 이동장치에 의한 사고, 기타 배상책임보험과 국가지원금을 통한 보상처리 가능 사고는 보상 대상에서 제외된다
김선갑 광진구청장은 “우리구는 올해 ‘더 안전하고, 더 건강한 광진’을 만들고자 다양한 구민 체감형 사업을 추진한다”며 “이를 위해 구민들이 각종 안전사고 발생 시, 실생활에 도움이 될 수 있도록 사고의료비를 지원하는 구민생활안전보험을 추진하기로 했다”고 말했다
박종일 기자 dream@asiae
co
kr▶ 2021년 신축년(辛丑年) 신년운세와 토정비결은?▶ 발 빠른 최신 뉴스, 네이버 메인에서 바로 보기▶ 2021년부터 이렇게 달라진다! 필수 체크!<ⓒ경제를 보는 눈, 세계를 보는 창 아시아경제 무단전재 배포금지>	"	https://news.naver.com/main/read.nhn?mode=LSD&mid=sec&sid1=102&oid=277&aid=0004835871
실손보험	광진구, 전 구민 생활안전보험, ‘최대 200만원’ 보상	" [광진구 제공][헤럴드경제=김유진 기자] 서울 광진구(구청장 김선갑)가 예기치 못한 각종 안전사고로부터 피해를 입은 구민에게 생활안정과 피해보상을 위한 제도적 장치를 마련하고자 구민생활안전보험에 가입했다고 27일 밝혔다
광진구 생활안전보험은 관내에 주민등록을 둔 모은 구민이면 누구나 자동으로 가입되며 2월 1일부터 혜택을 받을 수 있다
보장내용은 피해자의 과실 유무를 불문하고 상해의 직접결과로 발생한 장례 및 응급비용, 치료, 수술, X선검사, 치과치료, 입원 등에 대한 의료비용이며, 보장한도는 1인당 최대 200만 원(매 청구당 3만 원 공제)내에서 보상한다"	"광진구민은 2월부터 자동가입피해자 과실 유무 상관無상해 직접결과로 발생한 사고의료비용 보상포스터광진구구민생활안전보험
 [광진구 제공][헤럴드경제=김유진 기자] 서울 광진구(구청장 김선갑)가 예기치 못한 각종 안전사고로부터 피해를 입은 구민에게 생활안정과 피해보상을 위한 제도적 장치를 마련하고자 구민생활안전보험에 가입했다고 27일 밝혔다
구는 지난해부터 생활안전보험 시행을 위해 구민생활안전보험 운영 조례를 제정하고, 서울시 시민안전보험과 중복되지 않도록 검토해왔다
대다수 자치구에서 시행하고 있는 사망, 후유장애에 대한 위로금 형태의 정액형 보장이 아닌, 사고의료비를 보장하여구민이 실생활에 더 도움이 될 수 있도록 마련했다
광진구 생활안전보험은 관내에 주민등록을 둔 모은 구민이면 누구나 자동으로 가입되며 2월 1일부터 혜택을 받을 수 있다
 또한 개별적으로 가입한 실손의료보험과 중복지급이 가능하며, 보험가입 기간 중(광진구 거주 기간) 발생한 사고라면 발생일로부터 3년 내 보험청구 할 수 있다
보장내용은 피해자의 과실 유무를 불문하고 상해의 직접결과로 발생한 장례 및 응급비용, 치료, 수술, X선검사, 치과치료, 입원 등에 대한 의료비용이며, 보장한도는 1인당 최대 200만 원(매 청구당 3만 원 공제)내에서 보상한다
다만, 질병으로 인한 의료비, 교통사고, 산업재해, 자전거 및 개인형 이동장치에 의한 사고, 기타 배상책임보험과 국가지원금을 통한 보상처리 가능 사고는 보상 대상에서 제외된다
kacew@heraldcorp
com▶환경적 대화기구 '헤럴드에코'▶밀리터리 전문 콘텐츠 ‘헤밀’▶헤럴드경제 네이버 채널 구독- Copyrights ⓒ 헤럴드경제 & heraldbiz
com, 무단 전재 및 재배포 금지 -	"	https://news.naver.com/main/read.nhn?mode=LSD&mid=sec&sid1=102&oid=016&aid=0001785170
실손보험	우리은행, 모바일 실손보험 빠른청구 서비스 출시	"		우리은행은 진단서 등 종이서류가 없이도 모바일뱅킹 애플리케이션 ‘원(WON)뱅킹’을 통해 간편하게 보험금을 청구할 수 있는 ‘실손보험 빠른청구 서비스’를 출시했다고 22일 밝혔다
이번 서비스 대상은 삼성화재, 현대해상 등 31개 보험사 실손보험 가입자로 우리은행에서 실손보험에 가입하지 않은 고객도 이용할 수 있다
우리은행 관계자는 ""이번 서비스 시행으로 실손보험 가입자는 서류발급 비용과 병원방문 시간을 줄일 수 있으며, 보험사도 증빙서류 위·변조를 방지할 수 있다""며 ""병원도 증빙서류 발급을 줄여 환경보호에 기여하고 비용 절감도 예상된다""고 말했다"	"		우리은행은 진단서 등 종이서류가 없이도 모바일뱅킹 애플리케이션 ‘원(WON)뱅킹’을 통해 간편하게 보험금을 청구할 수 있는 ‘실손보험 빠른청구 서비스’를 출시했다고 22일 밝혔다
이번 서비스 대상은 삼성화재, 현대해상 등 31개 보험사 실손보험 가입자로 우리은행에서 실손보험에 가입하지 않은 고객도 이용할 수 있다
우리은행세브란스병원, 성모병원 등 90여개 주요 대형병원을 이용한 경우 진단서, 영수증 등 별도의 종이서류를 발급받을 필요 없이 WON뱅킹 내에서 보험금 청구가 가능하다
 제휴 병원을 제외한 일반 병원에서도 증빙서류를 스마트폰으로 촬영해 보험금을 청구할 수 있다
우리은행 관계자는 ""이번 서비스 시행으로 실손보험 가입자는 서류발급 비용과 병원방문 시간을 줄일 수 있으며, 보험사도 증빙서류 위·변조를 방지할 수 있다""며 ""병원도 증빙서류 발급을 줄여 환경보호에 기여하고 비용 절감도 예상된다""고 말했다
[이윤정 기자 fact@chosunbiz
com] ▶네이버에서 '명품 경제뉴스' 조선비즈를 구독하세요▶네이버·카카오, 웹툰 이어 웹소설로 글로벌 시장서 격돌▶창구 직원 14년 만에 지점장으로… 실적 선두 놓치지 않은 비결	저작권자 ⓒ 조선비즈, 무단 전재 및 재배포 금지"	https://news.naver.com/main/read.nhn?mode=LSD&mid=sec&sid1=101&oid=366&aid=0000657150
실손보험	"우리은행 ""실손보험 청구 WON뱅킹에서"""	"우리은행(은행장 권광석)은 실손보험 가입자가 진단서 등 종이서류 없이 모바일뱅킹 앱 'WON(원)뱅킹'에서 간편하게 보험금을 청구할 수 있는 '실손보험 빠른청구 서비스'를 출시했다고 22일 밝혔다
우리은행 관계자는 “WON뱅킹에서 다양한 생활편의서비스를 확대해 넘버원 금융 플랫폼으로 진화해 나가겠다”고 말했다
세브란스병원, 성모병원 등 90여개 주요 대형병원을 이용한 경우 진단서, 영수증 등 별도 종이서류를 발급받을 필요없이 WON뱅킹에서 보험금을 청구할 수 있다"	"우리은행(은행장 권광석)은 실손보험 가입자가 진단서 등 종이서류 없이 모바일뱅킹 앱 'WON(원)뱅킹'에서 간편하게 보험금을 청구할 수 있는 '실손보험 빠른청구 서비스'를 출시했다고 22일 밝혔다
이번 서비스 대상은 삼성화재, 현대해상 등 31개 보험사 실손보험 가입자다
 우리은행에서 실손보험에 가입하지 않은 고객도 이용할 수 있다
세브란스병원, 성모병원 등 90여개 주요 대형병원을 이용한 경우 진단서, 영수증 등 별도 종이서류를 발급받을 필요없이 WON뱅킹에서 보험금을 청구할 수 있다
 제휴 병원을 제외한 일반 병원에서도 증빙서류를 스마트폰으로 촬영해 보험금을 청구할 수 있다
우리은행 관계자는 “WON뱅킹에서 다양한 생활편의서비스를 확대해 넘버원 금융 플랫폼으로 진화해 나가겠다”고 말했다
배옥진기자 withok@etnews
com▶ ""K-시큐리티 서밋 2021"" 1월 29일 온라인 생중계▶ 네이버 홈에서 [전자신문] 구독하기 [Copyright ⓒ 전자신문 & 전자신문인터넷, 무단전재 및 재배포 금지]"	https://news.naver.com/main/read.nhn?mode=LSD&mid=sec&sid1=101&oid=030&aid=0002924697
실손보험	우리은행, WON뱅킹 실손보험 빠른청구 서비스 출시	" 사진=우리은행우리은행은 실손보험 가입자가 진단서 등 종이서류 없이도 모바일뱅킹 앱(App) WON(원)뱅킹을 통해 간편하게 보험금을 청구할 수 있는 실손보험 빠른청구 서비스를 출시했다고 22일 밝혔다
이번 서비스 시행으로 실손보험 가입자는 서류발급 비용과 병원방문 시간을 줄일 수 있으며 보험사도 증빙서류 위·변조를 방지할 수 있다
이번 서비스 대상은 삼성화재, 현대해상 등 31개 보험사 실손보험 가입자로 우리은행에서 실손보험에 가입하지 않은 고객도 이용할 수 있다"	"◆…우리은행이 WON뱅킹 실손보험 빠른청구 서비스를 출시했다
 사진=우리은행우리은행은 실손보험 가입자가 진단서 등 종이서류 없이도 모바일뱅킹 앱(App) WON(원)뱅킹을 통해 간편하게 보험금을 청구할 수 있는 실손보험 빠른청구 서비스를 출시했다고 22일 밝혔다
이번 서비스 대상은 삼성화재, 현대해상 등 31개 보험사 실손보험 가입자로 우리은행에서 실손보험에 가입하지 않은 고객도 이용할 수 있다
세브란스병원, 성모병원 등 90여개 주요 대형병원을 이용한 경우 진단서, 영수증 등 별도의 종이서류를 발급받을 필요 없이 WON뱅킹 내에서 보험금 청구가 가능하며 제휴 병원을 제외한 일반 병원에서도 증빙서류를 스마트폰으로 촬영해 보험금을 청구할 수 있다
우리은행 관계자는“우리은행의 대표 모바일 앱(App) WON뱅킹을 통해 이번 실손보험 빠른청구 서비스 외에도 다양한 생활편의서비스를 확대해 No
1 금융 플랫폼으로 진화해 나갈 것”이라고 말했다
이번 서비스 시행으로 실손보험 가입자는 서류발급 비용과 병원방문 시간을 줄일 수 있으며 보험사도 증빙서류 위·변조를 방지할 수 있다
 또한 병원도 증빙서류 발급을 줄여 환경보호에 기여하고 비용 절감도 예상된다
 ▶ 조세일보 홈페이지 / 정회원 가입▶ 조세일보 네이버 뉴스스탠드 구독(종합/경제)김대성(kimds@joseilbo
com)저작권자 ⓒ 조세일보(http://www
joseilbo
com)
 무단전재 및 재배포 금지	"	https://news.naver.com/main/read.nhn?mode=LSD&mid=sec&sid1=101&oid=123&aid=0002238775
