keyword	title	summary	content	url	date
금융당국+보험	보험료 부담 10% 낮춘 대리기사 전용 온라인 보험 나온다	"		대리기사 보험료 부담을 줄인 CM(온라인) 전용 개인보험 상품이 출시된다
금융위원회와 금융감독원은 28일 이 같은 내용을 골자로 하는 '필수노동자인 대리기사의 보험료 부담 완화 방안'을 마련해 추진한다고 발표했다
 대리운전업체가 보험사로부터 단체보험 모집수수료를 받거나, 실제 보험료 보다 많은 보험료를 수취해 단체보험을 강제할 유인이 있다는 지적에 따른 조치다"	"		대리기사 보험료 부담을 줄인 CM(온라인) 전용 개인보험 상품이 출시된다
 대리운전업체가 대리기사 개인보험 가입 여부를 실시간 확인해 보험에 중복 가입하는 사례를 예방하는 조회시스템도 상용화한다
금융위원회와 금융감독원은 28일 이 같은 내용을 골자로 하는 '필수노동자인 대리기사의 보험료 부담 완화 방안'을 마련해 추진한다고 발표했다
 이는 금융위 올해 업무계획 중 하나인 보험의 사적 안전망 기능 강화 후속 조치다
현재 10만명 대리기사와 4000개 수준 대리운전업체가 영업하고 있다
 하지만 대리기사가 개인보험에 가입하더라도 이 사실을 업체가 확인할 수 없어 복수 단체보험에 가입하는 등 불필요한 비용이 발생하고 있다
 게다가 대리기사를 위한 개인보험이 존재하지만, 보험료가 높아 전체 대리운전보험 중 7%(2020년 말 기준)에 수준에 불과하다
우선 금융당국은 대리기사를 위한 온라인 개인보험을 판매하기로 했다
 이 상품은 오프라인 모집수수료 등 사업비를 절감한 온라인 전용 상품으로, 종전 대비 10% 보험료 부담이 적은 것이 특징이다
29일 KB손해보험가 판매를 시작하며 3월 중 DB손해보험도 대리기사를 위한 온라인 전용 개인보험을 선보일 예정이다
 KB손보의 경우 종전 113만원이던 보험료가 96만원(15%↓)으로, DB손보는 114만원에서 100만원(12%↓)으로 보험료가 각각 줄어든다
금융당국은 또 대리운전 개인보험에도 보험료 할인·할증제도를 도입하기로 했다
 대리기사의 안전운전을 유도하는 한편 이들의 보험료 부담을 완화하기 위한 조치다
대리기사 보험 가입 여부를 실시간 확인하는 '대리운전 개인보험 가입조회시스템'도 오픈한다
개인보험에 가입한 대리기사가 조회시스템에 접속해 본인 개인정보 입력·정보활용 동의를 거치면 대리업체가 보험가입 여부를 확인한 이후에 대리콜을 배정하는 구조다
대리운전 시스템업체 중 콜마너를 이용하는 대리업체·기사는 29일부터 시스템에 접속해 개인정보를 등록할 수 있으며 대리콜은 2월 5일부터 가능하다
 로지(바나플), 아이콘소프트, 카카오모빌리티 등 다른 업체들은 2~3월 중 전산연결을 거쳐 서비스한다
대리운전업체의 불공정거래행위에 대한 관리·감독도 강화하기로 했다
 대리운전업체가 보험사로부터 단체보험 모집수수료를 받거나, 실제 보험료 보다 많은 보험료를 수취해 단체보험을 강제할 유인이 있다는 지적에 따른 조치다
금융위 관계자는 “대리운전보험 중복가입 문제 해소를 통해 특수형태근로종사자인 대리기사 보험료 부담이 크게 완화될 수 있을 것으로 기대한다”면서 “대리운전보험 보장사각지대 해소는 물론 질 높은 서비스 환경이 조성될 것”이라고 말했다
박윤호기자 yuno@etnews
com▶ ""K-시큐리티 서밋 2021"" 1월 29일 온라인 생중계▶ 네이버 홈에서 [전자신문] 구독하기 [Copyright ⓒ 전자신문 & 전자신문인터넷, 무단전재 및 재배포 금지]"	https://news.naver.com/main/read.nhn?mode=LSD&mid=sec&sid1=101&oid=030&aid=0002925825	2021-01-29
금융당국+보험	결국 中당국에 항복한 마윈…앤트그룹, 금융지주사로 바뀐다	"중국 최대 전자상거래기업 알리바바의 전자결제 체계 ‘알리페이’를 운영하는 핀테크 계열사 앤트그룹이 중앙은행인 런민은행의 관리감독을 받는 금융지주사로 바뀐다
 관영 신화통신 등에 따르면 시진핑(習近平) 국가주석은 27일 캐리 람 홍콩 행정장관으로부터 업무 보고를 받는 자리에서 ‘애국자가 홍콩을 다스린다(愛國者治港)’는 점을 거듭 강조했다
  27일 월스트리트저널(WSJ)은 앤트그룹이 금융지주사로 변신하겠다는 사업개편안을 당국에 제출했다고 보도했다"	"중국 최대 전자상거래기업 알리바바의 전자결제 체계 ‘알리페이’를 운영하는 핀테크 계열사 앤트그룹이 중앙은행인 런민은행의 관리감독을 받는 금융지주사로 바뀐다
 실질적 소유주인 마윈(馬雲) 알리바바 창업자가 지난해 10월 ‘전당포 영업’이란 용어로 금융당국의 폐쇄성과 후진성을 비판한 후폭풍으로 풀이된다
 기업가치 및 성장성 약화가 예상되는 가운데 일각에서는 국유화, 회사분할 가능성까지 거론한다
  27일 월스트리트저널(WSJ)은 앤트그룹이 금융지주사로 변신하겠다는 사업개편안을 당국에 제출했다고 보도했다
 지주사가 되면 당국에 상당한 자본금을 납입하고 증자 등을 단행해야 한다
 이 증자에 대형 국유은행과 연기금 등이 참여하면 마 창업자의 지분이 줄고 자연스레 국가 통제권이 커지는 구조다
 현재 마 창업자와 앤트그룹 임직원은 지분 50.5%를, 알리바바 또한 32.6%를 보유하고 있다
 당국은 다음달 춘제(중국의 설) 이전에 개편안을 확정할 것으로 알려졌다
  또한 런민은행은 최근 전자결제산업에서 특정 회사가 50% 이상의 점유율을 보유하면 강제분할이 가능한 규제 초안을 내놓았다
 이 안을 적용하면 점유율 50%가 넘는 알리페이가 2개 회사로 쪼개질 가능성을 배제할 수 없다
 이를 감안할 때 지주사 변신은 앤트그룹의 수익성과 성장성을 제한해 기업 가치에 부정적 효과를 미칠 것이라고 WSJ은 분석했다
 베이징 금융계 관계자 역시 “중국 기업인이 공산당 눈 밖에 나면 안 된다는 점을 보여준다”고 평가했다
  앤트그룹은 중국에서만 10억 명 이상의 사용자를 보유한 알리페이의 거대한 사용자 기반을 바탕으로 소액 대출, 온라인 보험, 자산운용업 등에서 중국 1위 사업자로 부상했다
 마 창업자는 그간 “앤트그룹은 금융사가 아닌 핀테크 회사이며 이에 적합한 낮은 수준의 규제를 받아야 한다”고 주장했다
 반면 당국은 런민은행 등이 규모를 파악하기 힘든 소액 대출이 급증하고 있는데다, 특정 기업가의 영향력이 지나치게 커진다는 점을 우려했다
 당초 앤트그룹은 운영 자율성을 높이기 위해 자회사 중 하나를 금융지주사로 만들어 소액대출 등 금융 업무를 맡기고, 블록체인 인공지능(AI) 빅데이터 등 핀테크 관련 업무에 주력하겠다는 뜻을 밝혔다
 이에 필요한 자금을 충당하기 위해 2200억 위안(약 38조 원)의 상하이 및 홍콩증시 동시상장도 추진했다
 그러나 마 창업자의 당국 비판 후 상장 계획이 무기한 중단됐고 알리바바 역시 반(反)독점법 위반 혐의로 조사를 받았다
 발언 직후 공개석상에서 자취를 감춘 마 창업자는 약 석 달이 흐른 이달 20일에야 모습을 드러냈다
  중국은 홍콩에 대한 통제 강도 또한 높이고 있다
 관영 신화통신 등에 따르면 시진핑(習近平) 국가주석은 27일 캐리 람 홍콩 행정장관으로부터 업무 보고를 받는 자리에서 ‘애국자가 홍콩을 다스린다(愛國者治港)’는 점을 거듭 강조했다
 그간 홍콩 자치권을 상징하던 ‘항인치항(港人治港)’ 즉 ‘홍콩인이 홍콩을 다스린다’는 문구에서 홍콩인을 뜻하는 ‘항인’ 표현 대신 ‘애국자’를 써서 홍콩이 중국의 통제권 하에 있음을 강조한 발언으로 풀이된다
 또한 시 주석은 2019년 송환법 반대 시위, 지난해 국가보안법 시위 등에서 제대로 대처하지 못해 경질설에 시달렸던 람 장관을 두고 “국가 안보에 대한 확고한 입장을 갖고 모국과 홍콩에 대한 사랑과 책임감을 드러냈다”고 치하했다
 베이징=김기용 특파원 kky@donga
com▶ 네이버에서 [동아일보] 채널 구독하기▶ 증발에 운다…그렇게 부모가 되지 못했다▶ “말이 안 통해”… 극과 극이 만난다면?ⓒ 동아일보 & donga
com, 무단 전재 및 재배포 금지	"	https://news.naver.com/main/read.nhn?mode=LSD&mid=sec&sid1=104&oid=020&aid=0003335469	2021-01-29
금융당국+보험	온라인 전용 대리운전기사 보험 나온다	"대리운전 시스템업체 중 '콜마너'를 이용하는 대리업체는 29일부터 시스템에 접속해 2월5일부터 대리콜 배정을 받을 수 있다
금융위원회는 대리운전기사 보험료 부담 완화 방안을 마련했다고 28일 밝혔다
금융당국은 제도 개선과 더불어 대리운전업체가 자사의 단체보험 가입을 강제하고 가입하지 않을 경우 콜을 배정하지 않는 불공정 행위에 대해서도 관리·감독을 강화할 예정이다"	"개인보험 가입조회시스템 오픈대리운전 기사들의 중복 보험 가입 문제를 해결하기 위해 대리운전 개인보험 가입조회시스템이 운영된다
  또 기존보다 최대 15% 가량 보험료가 저렴한 온라인 전용 대리운전 개인보험도 출시된다
금융위원회는 대리운전기사 보험료 부담 완화 방안을 마련했다고 28일 밝혔다
 대리운전 기사는 운전 중 사고에 대비해 단체형 또는 개인형 보험에 가입하는데, 단체보험은 특정 업체를 통해 대리운전한 경우에만 보상되는 문제가 있었다
 또 대리 운전기사가 개인보험에 가입하더라도 대리운전업체가 해당 사실을 확인할 수 없어 자사 단체보험에 중복으로 가입할 것을 요구하는 경우가 많았다
예를 들어 2개의 대리운전 업체로부터 일감(대리콜)을 배정받는 기사는 108만원 상당의 단체보험에 각각 가입해 총 216만원을 보험료로 지출했다
 금융당국이 구축한 '대리운전 개인보험 가입조회 시스템'은 대리기사가 해당 시스템에 접속해 본인의 개인정보를 입력하고 정보 활용에 동의하면 된다
 이후 대리업체가 대리기사의 보험 가입 여부를 확인한 뒤 대리콜을 배정하게 된다
대리운전 시스템업체 중 '콜마너'를 이용하는 대리업체는 29일부터 시스템에 접속해 2월5일부터 대리콜 배정을 받을 수 있다
 로지, 아이콘소프트, 카카오모빌리티 등 다른 대리운전 시스템업체는 2~3월 중 전산 연결을 완료할 예정이다
이와 함께 평균 110만원 수준인 단체보험보다 보험료가 10% 가량 저렴한 온라인(CM) 전용 개인보험도 출시된다
 CM개인보험은 평균 96만원이다
 아울러 대리운전 개인보험에도 할인할증제도를 도입해 대리기사의 안전 운전을 유도한다
금융당국은 제도 개선과 더불어 대리운전업체가 자사의 단체보험 가입을 강제하고 가입하지 않을 경우 콜을 배정하지 않는 불공정 행위에 대해서도 관리·감독을 강화할 예정이다
 금융위 관계자는 ""특수 형태 근로종사자인 대리기사의 보험료 부담이 크게 완화될 것""이라면서 ""국민들의 대리운전보험 보장사각지대 해소될 것으로 기대한다""고 말했다
(출처=금융위)    강민성기자 kms@dt
co
kr 디지털타임스 채널 구독 / 뉴스스탠드 구독디지털타임스 홈페이지 바로가기"	https://news.naver.com/main/read.nhn?mode=LSD&mid=sec&sid1=101&oid=029&aid=0002652170	2021-01-29
금융당국+보험	“손님도 줄었는데, 보험료 부담까지”…대리기사 단체보험 중복가입 손 본다	" 대리운전기사 전용  온라인 보험상품도 출시되는데, 기존 단체보험보다  15% 정도 보험료가 저렴합니다
 아울러 금융당국은 앞으로 대리운전업체가 단체보험을 강요할 경우, 공정거래법 위반 등을 적용해 공정거래위원회와 공동 대응할 방침입니다
대리운전 기사가 개인보험에 가입할 수도 있지만, 대리운전업체가 기사의 보험 가입 여부를 확인할 수 없기 때문입니다"	" [앵커] 보통 대리기사들은  손님 콜을 하나라도 더 받으려고 여러 개의 대리업체에 등록하는 경우가 많은데요
 이러다보니 업체별로 여러 개의 보험을 들어야 해서  부담이 큰 상황입니다
 이런 문제점을 해결하기 위해 정부가 대책을 내놓았습니다
 보도에 김진호 기자입니다
 [리포트] 코로나19 여파로 수입이 절반 이상 줄어든 대리운전 기사 이창배 씨
 [""안녕하세요
 대리기사입니다
""] 대리운전 보험이 2개나 가입돼 월 20만 원 가량을 보험료로만 내고 있습니다
 대리운전 업체마다 단체보험 가입을 요구하는 관행 탓입니다
 [이창배/대리운전 기사 : ""보험을 여러 개 들지 않고서는 다른 회사의 콜을 볼 수 없는 상황이 된 겁니다
 정상적으로 일을 하기 위해서 어쩔 수 없이 울며 겨자먹기로 보험을 이중, 삼중으로 들었던 상황입니다
""] 대리 운전업체 2곳에 등록된 기사의 경우  통상 단체보험도 2개를 들어야 하는데, 연간 220만 원 정도를 보험료로 내야 합니다
대리운전 기사가 개인보험에 가입할 수도 있지만, 대리운전업체가 기사의 보험 가입 여부를 확인할 수 없기 때문입니다
 이를 해결하기 위해  금융위원회가 대리운전 기사의 보험가입 여부를 실시간으로 확인할 수 있는 시스템을 내놓았습니다
 [김동환/금융위원회 보험과장 : ""대리운전 기사님들은 굳이 복수의 대리운전 업체별로 대리운전 보험을 가입할 필요가 없고, 그렇기 때문에 중복 보험료 부담을 할 필요가 없기 때문에 관행이 바뀔 것 같습니다
""] 다만, 이 시스템을 이용하려면 대리운전기사가  보험개발원 홈페이지에 들어가 개인정보 제공에 동의해야 합니다
 대리운전기사 전용  온라인 보험상품도 출시되는데, 기존 단체보험보다  15% 정도 보험료가 저렴합니다
 아울러 금융당국은 앞으로 대리운전업체가 단체보험을 강요할 경우, 공정거래법 위반 등을 적용해 공정거래위원회와 공동 대응할 방침입니다
 KBS 뉴스 김진호입니다
 촬영기자:임동수/영상편집:차정남/그래픽:김지훈김진호 (hit@kbs
co
kr)▶ 더 빠르고 정확한 소식을 원하시면 KBS뉴스 구독!▶ ‘코로나19 3차 대유행’ 제대로 알아야 이긴다"	https://news.naver.com/main/read.nhn?mode=LSD&mid=sec&sid1=101&oid=056&aid=0010980130	2021-01-29
금융당국+보험	결국… 마윈의 앤트그룹, 中 중앙銀 감독 받는 금융지주사 전환	" 27일 월스트리트저널(WSJ)은 앤트그룹이 금융지주사로 변신하겠다는 사업 개편안을 당국에 제출했다고 보도했다
 실질적 소유주인 마윈(馬雲·사진) 알리바바 창업자가 지난해 10월 ‘전당포 영업’이란 표현으로 금융당국의 폐쇄성과 후진성을 비판한 후폭풍으로 풀이된다
 관영 신화통신 등에 따르면 시진핑(習近平) 국가주석은 27일 캐리 람 홍콩 행정장관으로부터 업무 보고를 받는 자리에서 ‘애국자가 홍콩을 다스린다(愛國者治港)’는 점을 거듭 강조했다"	"마윈, 공산당에 백기… 핀테크 꿈 접어당국에 자본금 납입 위해 증자 필요국유은행 참여… 국가통제력 커질듯회사 분할-국유화 가능성도 거론시진핑 “애국자가 홍콩 다스린다”… 홍콩에 대한 중국의 통제권 강조중국 최대 전자상거래 기업 알리바바의 전자결제체계 ‘알리페이’를 운영하는 핀테크 계열사 앤트그룹이 중앙은행인 런민은행의 관리감독을 받는 금융지주사로 바뀐다
 실질적 소유주인 마윈(馬雲·사진) 알리바바 창업자가 지난해 10월 ‘전당포 영업’이란 표현으로 금융당국의 폐쇄성과 후진성을 비판한 후폭풍으로 풀이된다
 1월 포브스 기준 621억 달러(약 68조3100억 원)의 자산을 가진 세계적 부호 마윈조차 공산당의 눈 밖에 나면 백기투항이 불가피함을 보여주는 사례라는 분석이 나온다
 27일 월스트리트저널(WSJ)은 앤트그룹이 금융지주사로 변신하겠다는 사업 개편안을 당국에 제출했다고 보도했다
 지주사가 되면 당국에 상당한 자본금을 납입하고 증자 등을 단행해야 한다
 이 증자에 대형 국유은행과 연기금 등이 참여하면 마윈의 지분이 줄고 자연스레 국가 통제권이 커지는 구조다
 현재 마윈과 앤트그룹 임직원은 지분 50.5%를, 알리바바도 32.6%를 보유하고 있다
 당국은 다음 달 춘제(중국의 설) 전에 개편안을 확정할 것으로 알려졌다
 또한 런민은행은 최근 전자결제산업에서 특정 회사가 50% 이상의 지분 점유율을 보이면 강제 분할이 가능한 규제 초안을 내놨다
 이 안을 적용하면 점유율 50%가 넘는 알리페이가 2개 회사로 쪼개질 가능성을 배제할 수 없다
 이를 감안할 때 지주사 변신은 앤트그룹의 수익성과 성장성을 제한해 기업 가치에 부정적 영향을 미칠 것이라고 WSJ는 분석했다
  당초 앤트그룹은 운영 자율성을 높이기 위해 자회사 중 하나를 금융지주사로 만들어 소액대출 등 금융 업무를 맡기고, 블록체인 인공지능(AI) 빅데이터 등 핀테크 관련 업무에 주력하겠다는 뜻을 밝혔다
 이에 필요한 자금을 충당하기 위해 2200억 위안(약 38조 원)의 상하이 및 홍콩증시 동시 상장도 추진했다
 그러나 마윈이 금융당국을 비판한 뒤 상장 계획이 무기한 중단됐다
 알리바바 역시 반(反)독점법 위반 혐의로 조사를 받았다
 알리바바 주가 폭락으로 마윈의 재산 또한 최소 120억 달러(약 13조2000억 원) 증발했다는 보도도 나왔다
 비판 발언 직후 공개석상에서 사라졌던 그는 약 석 달이 흐른 이달 20일에야 모습을 드러냈다
 일각에서는 당국이 지주사 전환을 넘어 앤트그룹에 대한 국유화, 회사 분할까지 압박할 가능성을 거론한다
 앤트그룹은 중국에서만 10억 명 이상인 알리페이의 거대한 사용자 기반을 바탕으로 소액 대출, 온라인 보험, 자산운용업 등에서 중국 1위 사업자로 부상했다
 당국은 런민은행 등이 규모를 파악하기 힘든 소액 대출이 급증하고 있는 데다 마윈 같은 특정 기업가의 영향력이 지나치게 커진다는 점을 우려하고 있다
 특히 알리페이 결제의 보편화로 법정화폐 ‘런민비(人民幣)’ 위상이 흔들리는 점을 못마땅하게 여겨왔다
  중국은 홍콩에 대한 통제 강도도 높이고 있다
 관영 신화통신 등에 따르면 시진핑(習近平) 국가주석은 27일 캐리 람 홍콩 행정장관으로부터 업무 보고를 받는 자리에서 ‘애국자가 홍콩을 다스린다(愛國者治港)’는 점을 거듭 강조했다
 그간 홍콩 자치권을 상징하던 ‘항인치항(港人治港)’ 즉 ‘홍콩인이 홍콩을 다스린다’는 문구에서 홍콩인을 뜻하는 ‘항인’ 대신 ‘애국자’를 써서 홍콩이 중국의 통제권 아래에 있음을 강조한 발언으로 풀이된다
베이징=김기용 특파원 kky@donga
com▶ 네이버에서 [동아일보] 채널 구독하기▶ 증발에 운다…그렇게 부모가 되지 못했다▶ “말이 안 통해”… 극과 극이 만난다면?ⓒ 동아일보 & donga
com, 무단 전재 및 재배포 금지	"	https://news.naver.com/main/read.nhn?mode=LSD&mid=sec&sid1=104&oid=020&aid=0003335585	2021-01-29
금감원+보험	[단독] 분쟁조정 신청했더니 GA ‘꼼수 소송’… 보험설계사 발목잡는다	"”보험설계사 송인석(66·가명)씨는 거대 보험대리점(GA)인 A사 소속이던 2019년 10월부터 지난해 1월까지 대형 보험 계약 3건을 따냈다
28일 국회 정무위원회 소속 더불어민주당 민형배 의원실에 따르면 금감원이 처리한 생명보험 관련 금융 분쟁은 2018년 5766건에서 2020년 6613건으로 12.8% 늘었다
금융사로부터 당한 금전적 피해를 법으로 풀기엔 재정·시간적 여력이 없는 개인을 위해 마련된 분쟁조정제도가 꼼수 앞에 무력해지는 일이 빈번해졌다"	"조정기간 3개월… 소송 땐 중재 강제종료최종심까지 2년… 생보사 제도 악용 늘어설계사들 업계 내 이직 어려워 무직자로“금융감독원 분쟁 조정만 믿고 있었는데, 꼼수 앞에 당장 먹고살 길이 막막하네요
”보험설계사 송인석(66·가명)씨는 거대 보험대리점(GA)인 A사 소속이던 2019년 10월부터 지난해 1월까지 대형 보험 계약 3건을 따냈다
 회사와 계약한 조건대로라면 모집 수당으로 2억 2400만원을 받아야 했다
 하지만 A사가 준 돈은 8000만원이 전부였다
 같은 회사 소속인 다른 보험설계사 성지석(49·가명)씨도 유지 수당(보험계약을 유지하면 주는 돈)을 못 받았다
 회사의 담당 임원은 “금감원의 종합검사를 대비해 장부를 맞춰 놔야 하는데 돈이 모자라니 다음달로 미루자”는 이유를 댔다
 받아들일 수 없었던 두 설계사는 금감원에 분쟁 조정을 신청했다
 보통 3개월이면 조정 절차가 끝나기에 곧 수당을 받을 수 있을 것으로 믿었다
 하지만 이 사실을 안 회사 대표 김모씨가 “오히려 돈을 더 줬으니 돌려받아야겠다”며 민사소송을 내면서 분쟁 조정이 중단됐다
 민원처리법상 소송이 제기되면 분쟁 조정은 진행될 수 없다
 송씨는 “대표가 탈세하려고 보험사에서 나온 수당을 내 계좌에 입금받도록 한 뒤 인출해 현금으로 받아 갔는데, 이를 돈을 준 증거처럼 제시했다”며 황당해했다
금융사로부터 당한 금전적 피해를 법으로 풀기엔 재정·시간적 여력이 없는 개인을 위해 마련된 분쟁조정제도가 꼼수 앞에 무력해지는 일이 빈번해졌다
 특히 국내 대형 보험대리점이나 보험사들이 분쟁 조정을 막으려고 억지 소송을 걸어 피해자를 더 힘들게 하고 있다는 지적이다
28일 국회 정무위원회 소속 더불어민주당 민형배 의원실에 따르면 금감원이 처리한 생명보험 관련 금융 분쟁은 2018년 5766건에서 2020년 6613건으로 12.8% 늘었다
 특히 민사소송을 이유로 취소된 분쟁은 2018년 5건에서 2019년 23건, 2020년 33건으로 계속 증가하고 있다
 보험업계에서는 “금융사가 진짜 억울해 소송을 건 사례도 있겠지만 분쟁 조정 절차를 피하고 시간을 끌기 위해 소송하는 일이 적지 않다”는 말이 나온다
사건이 법원으로 가면 최종심을 받는 데 2년 이상 걸리는 일이 흔하다
 송씨처럼 생활 자금이 급해 분쟁 조정을 신청했던 입장에서는 소송을 통해 이겨 봤자 ‘상처뿐인 승리’로 끝난다
 소송이 진행되는 동안에는 업계 내 이직이 현실적으로 어려워 무직자로 전락할 수 있다
반면 금융사 입장에서는 분쟁 조정 대신 민사 소송을 택하면 득이 많다
 보험전문 박기억 변호사는 “금감원 분쟁조정위원회에서 검사하면 자료 요구 등을 많이 하는데 법원으로 가면 아무도 관여 없이 재판이 진행되기에 유능한 변호사를 선임할 수 있는 금융사가 유리할 수밖에 없다”고 말했다
 또 영업정지 같은 행정처분에서도 자유로워진다
20대 국회 때 더불어민주당 제윤경 전 의원이 5000만원 이내 소액 사건의 경우 분쟁조정 신청 이후 금융사의 소송 제기를 금지하는 내용의 법안을 발의했지만 회기가 끝나 폐기됐다
 A사 측은 “송씨와 성씨가 계약 유지를 못해 수당을 환수하려고 소송을 건 것”이라고 주장했다
윤연정 기자 yj2gaze@seoul
co
kr유대근 기자 dynamic@seoul
co
kr▶ 네이버에서 서울신문 구독하기 클릭! ▶ 세상에 이런 일이 ▶ [연예계 뒷얘기] 클릭!ⓒ 서울신문(www
seoul
co
kr), 무단전재 및 재배포금지	"	https://news.naver.com/main/read.nhn?mode=LSD&mid=sec&sid1=101&oid=081&aid=0003159789	2021-01-29
