keyword	title	summary	content	url
삼성생명	"이재용 ""흔들리지 말고 삼성 갈 길 가야""..."	" “국민과의 약속 지키겠다”26일 삼성전자에 따르면 이 부회장은 김기남 디바이스솔루션(DS)부문 부회장과 김현석 소비자가전(CE)부문 사장, 고동진 IT·모바일(IM)부문 사장 명의의 임직원 대상 호소문을 통해 “흔들리지 말아 달라”는 뜻을 전했다
 재판부는 “삼성의 새로운 준법감시제도가 발생 가능한 새로운 위험에 대한 예방과 감시 활동에 이르지 않은 것으로 보인다”고 지적하며 이 부회장에게 실형을 선고했다
 이어 “제가 처한 상황과 관계없이 삼성은 가야 할 길을 계속 가야 한다”며 “이미 국민들께 드린 약속은 반드시 지켜야 한다”고 강조했다"	"임직원들에게 옥중 당부 ""준법경영·투자·고용…국민과 약속 반드시 지키자""사내 게시판에 메시지 남겨""삼성 사회적 책임 다해야""준법위, 7개 계열사 CEO 만남""준법경영 경영진 의지가 중요""삼성준법감시위원회는 26일 삼성 7개 계열사 최고경영진과 간담회를 열었다
 이날 행사엔 김지형 위원장(맨 왼쪽)과 김기남 삼성전자 부회장(오른쪽) 등이 참석했다
 삼성준법감시위원회 제공이재용 삼성전자 부회장이 임직원들의 동요를 막기 위한 옥중 메시지를 내놨다
 자신이 처한 상황과 관계없이 삼성은 가야 할 길을 가야 한다는 것이 골자다
 이 부회장이 임직원들에게 옥중 메시지를 남긴 것은 이번이 처음이다
 국정농단 사건으로 처음 구속된 2017년 2월엔 이 부회장이 아니라 사장단 명의의 메시지가 나왔다
 ‘총수 부재’라는 엄혹한 상황에서도 흔들리지 말아줄 것을 호소하기 위해 이 부회장이 직접 목소리를 냈다는 해석이 나온다
 “국민과의 약속 지키겠다”26일 삼성전자에 따르면 이 부회장은 김기남 디바이스솔루션(DS)부문 부회장과 김현석 소비자가전(CE)부문 사장, 고동진 IT·모바일(IM)부문 사장 명의의 임직원 대상 호소문을 통해 “흔들리지 말아 달라”는 뜻을 전했다
 이 부회장의 구술을 변호인이 적어 사장단에게 전달했다는 것이 삼성 측 설명이다
이 부회장은 “저의 부족함 때문에 다시 걱정을 끼쳐드리게 돼 무척 송구하다”며 “너무 큰 짐을 안겨드린 것 같아 정말 죄송한 마음”이라고 말했다
 이어 “제가 처한 상황과 관계없이 삼성은 가야 할 길을 계속 가야 한다”며 “이미 국민들께 드린 약속은 반드시 지켜야 한다”고 강조했다
국민과의 약속이 무엇인지도 분명히 했다
 이 부회장은 “투자와 고용 창출이라는 기업 본분에 충실해야 하고 나아가 사회적 책임을 다하는 삼성으로 거듭나야 한다”고 설명했다
 다시 임직원들과 함께 일하고 싶다는 뜻도 드러냈다
 그는 “지금 시간이 결코 헛되지 않도록 하겠다”며 “여러분과 함께 꼭, 새로운 삼성을 만들도록 하겠다”고 말했다
 이 부회장은 지난 18일 국정농단 사건 파기환송심 재판에서 2년6개월형을 선고받고 법정 구속됐다
 준법경영 다짐한 삼성 계열사들이날 삼성준법감시위원회(준법위)는 삼성전자 서울 서초사옥에서 삼성전자, 삼성물산, 삼성생명 등 주요 7개 삼성 계열사 최고경영진과 간담회를 했다
 각 사의 준법경영 현황을 듣고 개선점을 논의하기 위한 자리였다
 삼성전자에선 김 부회장과 최윤호 사장(CFO·최고재무책임자)이 참석했다
 전영현 삼성SDI 사장, 경계현 삼성전기 사장, 황성우 삼성SDS 사장, 고정석 삼성물산 사장, 전영묵 삼성생명 사장, 최영무 삼성화재 사장 등도 함께했다
김지형 준법위원장은 인사말을 통해 만남과 소통의 중요성을 강조하며 “준법경영에 대한 최고경영진의 의지가 중요하다”고 말했다
 김 부회장은 이에 대해 “준법경영을 통해 삼성이 초일류기업을 넘어 존경받는 기업이 되도록 노력하겠다”고 답했다
준법경영은 이 부회장이 지속적으로 강조한 덕목이다
 그는 구속 사흘째인 지난 21일에도 변호인을 통해 “준법위 활동을 계속 지원하겠다”는 뜻을 전했다
 이어 준법위원들에게 “앞으로도 계속 본연의 역할을 다해 주실 것”을 부탁했다
준법위는 국정농단 사건 파기환송심 재판부가 삼성에 △과감한 혁신 △내부 준법감시제도 마련 △재벌체제 폐해 시정 등을 주문하며 출범한 조직이다
 당시 재판부는 준법위 활동을 평가해 양형에 반영하겠다고 밝혔지만 결과는 예상과 달랐다
 재판부는 “삼성의 새로운 준법감시제도가 발생 가능한 새로운 위험에 대한 예방과 감시 활동에 이르지 않은 것으로 보인다”고 지적하며 이 부회장에게 실형을 선고했다
송형석 기자 click@hankyung
com▶ 경제지 네이버 구독 첫 400만, 한국경제 받아보세요▶ 한경 고품격 뉴스레터, 원클릭으로 구독하세요▶ 한국경제신문과 WSJ, 모바일한경으로 보세요 ⓒ 한국경제 & hankyung
com, 무단전재 및 재배포 금지	"	https://news.naver.com/main/read.nhn?mode=LSD&mid=sec&sid1=101&oid=015&aid=0004489942
삼성생명	"이재용 ""삼성은 가야 할 길 계속 가야""…투자·고용·사회적책임 강조"	"삼성 사내 게시판 통해 임직원들에 첫 메시지 전달[이데일리 피용익 신중섭 배진솔 기자] 이재용 삼성전자 부회장은 26일 “제가 처한 상황과는 관계없이 삼성은 가야 할 길을 계속 가야 한다”며 투자와 고용, 그리고 사회적 책임을 다해줄 것을 삼성 임직원들에게 당부했다
삼성 관계자는 “이재용 부회장은 경영을 챙길 수 없는 상황이지만, 임직원들이 책임을 다해 고용·투자 약속을 지키고 사회에 기여할 수 있는 것을 찾아 함께 나누자는 것을 강조한 것”이라고 설명했다
이 부회장의 구속 이후 삼성전자의 경영 차질과 대규모 투자가 어려워질 것이라는 우려가 나오는 것에 대한 발언으로 해석된다"	"삼성 사내 게시판 통해 임직원들에 첫 메시지 전달[이데일리 피용익 신중섭 배진솔 기자] 이재용 삼성전자 부회장은 26일 “제가 처한 상황과는 관계없이 삼성은 가야 할 길을 계속 가야 한다”며 투자와 고용, 그리고 사회적 책임을 다해줄 것을 삼성 임직원들에게 당부했다
국정농단 파기환송심 재판에서 실형을 선고받고 구속 수감된 이재용 부회장은 이날 전 계열사 사내 게시판을 통해 임직원들을 향해 첫 옥중 메시지를 발신했다
 이 부회장이 임직원들을 대상으로 메시지를 낸 건 지난 2019년 11월 1일 삼성전자 창립 50주년 기념사에서 “우리의 기술로 더 건강하고 행복한 미래를 만들자”고 강조한 뒤 이번이 처음이다
 이 부회장의 이번 메시지는 삼성전자의 대표이사 3인인 김기남 부회장과 김현석·고동진 사장이 사내 내부망에 “저희는 지금 참담한 심정과 비상한 각오로 이재용 부회장의 메시지를 대신 전합니다”라며 올린 글을 통해 처음 공개됐다
 이어 삼성SDI, 삼성물산, 삼성생명 등 삼성그룹 전 계열사 사장들 명의로 각 사 사내망에 이 부회장의 메시지를 전달했다
 이 부회장은 “삼성 가족 여러분, 저의 부족함 때문에 다시 걱정을 끼쳐드리게 되었다”면서 “너무 송구하고 너무 큰 짐을 안겨드린 것 같아 정말 죄송한 마음”이라고 착잡한 심경을 밝혔다
 이 부회장은 “지난 수년간 삼성은 안팎으로 많은 어려운 사정들이 있었다”며 “하지만 여러분께서는 묵묵히 일하며 삼성을 굳건히 지켜주셨듯이, 앞으로도 흔들림 없이 한마음이 되어 주시길 부탁드린다”고 당부했다
그는 “제가 처한 상황과 관계없이 삼성은 가야 할 길을 계속 가야 한다”며 “이미 국민들께 드린 약속들은 반드시 지켜야 한다”고 했다
 그러면서 투자와 고용 창출이라는 기업의 본분에도 충실해야 하며, 나아가 사회적 책임을 다하는 삼성으로 거듭나야 한다고 강조했다
이 부회장의 구속 이후 삼성전자의 경영 차질과 대규모 투자가 어려워질 것이라는 우려가 나오는 것에 대한 발언으로 해석된다
 삼성전자는 현재 미국 오스틴 공장 증설, 평택 P3 공장 등 반도체 관련 대규모 투자 결정을 앞두고 있다
이 부회장은 이러한 당부와 함께 “저는 더욱 자숙하면서 겸허하게 스스로를 성찰하겠다”고 반성했다
 이어 “지금 시간이 결코 헛되지 않도록 하겠다
 여러분과 함께 꼭 새로운 삼성을 만들도록 하겠다”고 글을 마무리했다
앞서 이 부회장은 지난 18일 국정농단 파기환송심에서 징역 2년6개월의 실형을 선고받고 서울구치소에 재수감됐다
 재상고 시한 마지막 날인 지난 25일 이 부회장측과 박영수 특별검사팀 모두 재상고를 하지 않기로 하면서 이 부회장에게는 징역 2년6개월 형이 확정됐다
 이 부회장은 중간에 특별사면이나 가석방 등이 없을 경우 내년 7월에 만기 출소하게 된다
삼성 관계자는 “이재용 부회장은 경영을 챙길 수 없는 상황이지만, 임직원들이 책임을 다해 고용·투자 약속을 지키고 사회에 기여할 수 있는 것을 찾아 함께 나누자는 것을 강조한 것”이라고 설명했다
한편 이날 삼성전자를 비롯한 7개 계열사 사장들은 준법감시위원회 위원들과 첫 모임을 갖고 이 부회장이 당부한 준법 감시 기능 강화 방안을 비롯해 모임 정례화 등에 대해 논의했다
 위원회 출범 이후 처음 실시된 최고경영진과의 간담회에는 김지형 위원장을 포함한 위원 전원과 삼성전자(005930) 김기남 부회장, 최윤호 사장(CFO), 삼성SDI(006400) 전영현 사장, 삼성전기(009150) 경계현 사장, 삼성SDS(018260) 황성우 사장, 삼성물산(028260) 고정석 사장, 삼성생명(032830) 전영묵 사장, 삼성화재(000810) 최영무 사장이 참석했다
김기남 부회장은 “준법경영을 통해 삼성이 초일류기업을 넘어 존경을 받는 기업이 되도록 노력하겠다”고 소감을 밝혔다
 관계사 대표이사들은 회사 소개와 함께 각 사의 준법경영 현황에 대해 설명하며 책임감을 가지고 준법경영에 앞장서겠다고 다짐했다
 준법감시위 위원들은 삼성이 한 단계 더 도약하기 위해서는 준법경영에 대한 최고경영진의 의지가 가장 중요하다는 점을 거듭 강조했다
 [이데일리 방인권 기자] 이재용 삼성전자 부회장이 지난 18일 오후 서울 서초구 서울고등법원에서 열린 국정농단 사건 파기환송심 선고 공판에 출석하고 있다
피용익 (yoniki@edaily
co
kr)▶ #24시간 빠른 #미리보는 뉴스 #eNews+▶ 네이버에서 '이데일리 뉴스'를 만나보세요▶ 빡침해소, 청춘뉘우스 '스냅타임'＜ⓒ종합 경제정보 미디어 이데일리 - 무단전재 & 재배포 금지＞"	https://news.naver.com/main/read.nhn?mode=LSD&mid=sec&sid1=101&oid=018&aid=0004838020
삼성생명	"삼성 준법위, 최고경영진과 첫 간담회... ""준법경영 강화할 것""(종합)"	"		삼성 준법감시위원회가 26일 삼성전자(005930)등 7개 협약사 최고경영진 간담회를 열고 계열사별 준법경영 강화 방안을 논의했다
준법감시위는 이날 오전 10시 서울 서초구 삼성전자 서초사옥에서 삼성전자, 삼성전기(009150), 삼성SDI(006400), 삼성SDS(018260), 삼성생명(032830), 삼성화재(000810), 삼성물산(028260)등 7개 관계사 대표이사와 2시간가량 비공개 간담회를 개최했다
com] ▶네이버에서 '명품 경제뉴스' 조선비즈를 구독하세요▶올해 건설업계 생존전략 3대 키워드는?▶""이번 CES 혁신상 넷 중 하나는 한국 제품"" 	저작권자 ⓒ 조선비즈, 무단 전재 및 재배포 금지"	"		삼성 준법감시위원회가 26일 삼성전자(005930)등 7개 협약사 최고경영진 간담회를 열고 계열사별 준법경영 강화 방안을 논의했다
준법감시위는 이날 오전 10시 서울 서초구 삼성전자 서초사옥에서 삼성전자, 삼성전기(009150), 삼성SDI(006400), 삼성SDS(018260), 삼성생명(032830), 삼성화재(000810), 삼성물산(028260)등 7개 관계사 대표이사와 2시간가량 비공개 간담회를 개최했다
위원회 출범 후 처음 열린 최고경영진 간담회에는 김기남 삼성전자 부회장과 최윤호 삼성전자 경영지원실 사장, 전영현 삼성SDI 사장, 경계현 삼성전기 사장, 황성우 삼성SDS 사장, 전영묵 삼성생명 사장, 최영무 삼성화재 사장, 고정석 삼성물산 사장 등이 참석했다
김지형 삼성 준법감시위원회 위원장
/연합뉴스김지형 준법위 위원장은 인사말을 통해 만남과 소통의 중요성을 강조했다
 김기남 부회장은 준법경영을 통해 삼성이 초일류기업을 넘어 존경을 받는 기업이 되도록 노력하겠다고 밝혔다고 위원회는 전했다
김 위원장은 ""다음에는 김기남 부회장 주재로 한 번 더 간담회를 통해 얘기를 나누자""고 제안했고 김 부회장은 이를 흔쾌히 승낙한 것으로 전해졌다
 다음 간담회 일정을 정해지지 않았다
준법위 관계자는 ""대표이사들이 준법 경영 부분을 계열사별로 강화해보자는 얘기를 나눴다""며 ""구체적인 현안을 해결하는 회의라기 보다 어색한 분위기를 풀고, 앞으로 도와가며 더 잘해보자는 취지의 만남이었다""고 했다
 수감된 이재용 부회장 관련 논의도 있었냐는 질문에 ""아예 없었던 것은 아니었지만, 최근 발생한 일들에 대해 좀 더 잘해야겠다는 취지의 얘기가 나왔다""고 전했다
이날 이재용 부회장 파기환송심 재판부가 지적한 준법위 실효성 문제나 사업지원TF 준법감시 강화 방안 등은 거론되지 않은 것으로 전해졌다
[송기영 기자 rckye@chosunbiz
com] ▶네이버에서 '명품 경제뉴스' 조선비즈를 구독하세요▶올해 건설업계 생존전략 3대 키워드는?▶""이번 CES 혁신상 넷 중 하나는 한국 제품"" 	저작권자 ⓒ 조선비즈, 무단 전재 및 재배포 금지"	https://news.naver.com/main/read.nhn?mode=LSD&mid=sec&sid1=101&oid=366&aid=0000659369
삼성생명	준법위-삼성 CEO 첫 상견례	" 이재용 삼성전자 부회장이 국정농단 파기환송심에서 2년 6개월의 실형을 선고받고 구속수감된 이후 첫 회동이다
&apos;삼성 준법문화 정착&apos; 노력(지디넷코리아=권혜미  기자)삼성준법감시위원회가 7개 삼성 계열사 최고경영자(CEO)와 첫 상견례 자리를 가졌다
준법감시위는 26일 오전 10시 서울 서초구 삼성전자 서초사옥에서 삼성전자, 삼성전기, 삼성SDI, 삼성SDS, 삼성생명, 삼성화재, 삼성물산 등 7개 관계사 대표이사와 간담회를 개최했다"	"삼성전자 서초사옥서 26일 오전 만나


&apos;삼성 준법문화 정착&apos; 노력(지디넷코리아=권혜미  기자)삼성준법감시위원회가 7개 삼성 계열사 최고경영자(CEO)와 첫 상견례 자리를 가졌다
 이재용 삼성전자 부회장이 국정농단 파기환송심에서 2년 6개월의 실형을 선고받고 구속수감된 이후 첫 회동이다
준법감시위는 26일 오전 10시 서울 서초구 삼성전자 서초사옥에서 삼성전자, 삼성전기, 삼성SDI, 삼성SDS, 삼성생명, 삼성화재, 삼성물산 등 7개 관계사 대표이사와 간담회를 개최했다
비공개로 진행된 이날 간담회에는 김지형 준법감시위 위원장 등 위원들과 김기남 삼성전자 부회장, 최윤호 삼성전자 사장, 전영현 삼성SDI 사장, 경계현 삼성전기 사장, 황성우 삼성SDS 사장, 전영묵 삼성생명 사장, 최영무 삼성화재 사장, 고정석 삼성물산 사장 등이 참석했다
삼성전자 서초사옥 전경이 자리에서는 상견례와 함께 관계사 준법문화 정착을 위한 최고경영진 역할 등에 대해 심도 깊은 의견교환이 진행됐다
앞서 재판부는 준법위의 실효성과 지속성을 인정하기 어렵다며 이 부회장의 양형요소로 반영하지 않으면서 준법위 활동이 애매해지는 게 아니냐는 지적이 있었다
하지만 이 부회장은 지난 21일 변호인단을 통해 ""준법위 활동을 계속 지원하겠다는 다짐과 함께, 위원장과 위원들께는 앞으로도 계속 본연의 역할을 다해 주실 것을 간곡하게 부탁했다""는 입장을 전달하면서 준법위 존속을 약속한 바 있다
또 이날 오전 삼성그룹 사내용 인트라넷을 통해 ""제가 처한 상황과 관계없이 삼성은 가야 할 길을 계속 가야 한다""며 ""여러분과 함께 꼭, 새로운 삼성을 만들도록 하겠다""고 임직원들에게 메시지를 전했다
권혜미 기자(hyeming@zdnet
co
kr) ▶ 지디넷코리아 '홈페이지' ▶ 네이버 채널 구독하기© 메가뉴스 & ZDNET, A RED VENTURES COMPANY, 무단전재-재배포 금지	"	https://news.naver.com/main/read.nhn?mode=LSD&mid=sec&sid1=105&oid=092&aid=0002211823
