keyword	title	summary	content	url	date
GA+보험	생보협회 “연 700만에 막힌 연금보험 세액공제 한도 상향 추진”	"장기유지시 보너스 혜택도 검토정희수 생명보험협회 회장 [헤럴드DB][헤럴드경제=정경수 기자] 생명보험협회가 현재 700만원인 개인연금, 퇴직연금 합산 세액공제 한도를 상향하는 방안을 검토한다
 오는 2월 생보손보 업계 CEO가 참석해 금융업권 최초로 ESG 경영실천을 선포할 예정이다
이와 함께 생보협회는 공공 보건의료데이터 이용 범위 확대, 헬스케어서비스의 상품화를 추진한다"	"장기유지시 보너스 혜택도 검토정희수 생명보험협회 회장 [헤럴드DB][헤럴드경제=정경수 기자] 생명보험협회가 현재 700만원인 개인연금, 퇴직연금 합산 세액공제 한도를 상향하는 방안을 검토한다
정희수 생보협회 회장은 28일 비대면 기자간담회를 통해 이러한 계획을 밝혔다
지난 2018년 기준 사적연금 가입률은 16.9%로 경제개발협력기구(OECD) 평균인 67.5%를 훨씬 밑돈다
 구체적으로 보면 퇴직연금과 연금저축 가입률은 각각 51.3%, 11.9%에 불과하다
고객들의 수요를 끌어낼 유인이 낮은 탓이다
 연금저축보험은 세제 적격 상품으로 2014년 소득공제에서 세액공제로 전환돼 연말정산 때 환급액이 줄었다
 400만원까지 소득공제를 받던 게 세액공제로 바뀌면서 최대 100만원이던 환급액이 약 50만원으로 반 토막이 난 것이다
이에 따라 생보협회는 연금보험 혜택 확대를 추진한다
 현재 IRP(개인형퇴직연금)과 퇴직연금, 연금저축을 합산해 연간 납입액 700만원까지 세액공제를 받을 수 있는데, 이 한도를 올려달라고 세제당국에 건의할 예정이다
아울러 장기간 가입을 유지할수록 장기 유지 보너스 혜택을 제공하도록 상품 구조를 개편할 계획이다
 자녀 출생, 청년 가입에 따라 연금 보조금을 지급하는 독일 사례 등도 함께 고민한다
이와 함께 생보협회는 공공 보건의료데이터 이용 범위 확대, 헬스케어서비스의 상품화를 추진한다
 이를 위해 건강보험공단, 건강보험심사평가원 등과 함께 보건의료 데이터 활용 방안을 논의할 계획이다
 현재까진 보건당국과 의료계가 연구 목적을 벗어나 영리 목적으로 의료데이터를 활용하는 것에 대해 반대하고 있다
또 ESG(환경·사회·지배구조) 경영 확산에도 힘쓴다
 오는 2월 생보손보 업계 CEO가 참석해 금융업권 최초로 ESG 경영실천을 선포할 예정이다
보험 비대면 가입도 활성화한다
 모바일 청약절차에도 의무적으로 대면 설명이 필요하고 복잡한 서류 교부와 서명도 거쳐야 한다
 이러한 문제를 개선해 서명 방식 간소화, 인공지능(AI)을 활용한 상담, 가입설계를 확대할 계획이다이 밖에 실손보험금 청구 간소화, 대형 법인대리점(GA)에 1차 배상책임 부여, 보험사기방지 특별법 개정 등도 국회서 법 통과될 수 있도록 적극 지원할 예정이다
kwater@heraldcorp
com▶환경적 대화기구 '헤럴드에코'▶밀리터리 전문 콘텐츠 ‘헤밀’▶헤럴드경제 네이버 채널 구독- Copyrights ⓒ 헤럴드경제 & heraldbiz
com, 무단 전재 및 재배포 금지 -	"	https://news.naver.com/main/read.nhn?mode=LSD&mid=sec&sid1=101&oid=016&aid=0001786174	2021-01-29
보험업계	"정희수 생보협회장 ""보험업계 긴박한 위기…성장기반 마련해야"""	"[한국경제TV 장슬기 기자]정희수 생명보험협회장은 오늘(28일) ""현재 생명보험업계가 처한 상황은 매우 엄중하고 긴박한 위기""라고 진단했다
정 회장은 이날 비대면 기자간담회를 통해 ""초저금리에 따른 이차역마진 심화와 재무건전성 규제 강화, 저출산 고령화에 따른 보험수요 감소 등 전방위적으로 경영환경이 악화되고 있다""며 ""이런 위기를 극복하고 미래를 향한 도전과 지속적인 성장 기반을 마련하기 위한 대응방안이 필요하다""고 밝혔다
정 회장은 ""건강보험공단 등 가명처리된 보건의료데이터의 보험사 활용체계를 조속히 협의, 확정하고 금융위와 보건복지부 등 정부, 유관기관과 관계법령 정비를 협의해 나갈 예정""이라며 ""상반기 중 국회, 유관기관과의 연계 세미나, 토론회 등을 통해 생보사의 공공 보건의료 데이터 이용의 필요성에 대한 공감대를 확신시킬 계획""이라고 강조했다"	"[한국경제TV 장슬기 기자]정희수 생명보험협회장은 오늘(28일) ""현재 생명보험업계가 처한 상황은 매우 엄중하고 긴박한 위기""라고 진단했다
정 회장은 이날 비대면 기자간담회를 통해 ""초저금리에 따른 이차역마진 심화와 재무건전성 규제 강화, 저출산 고령화에 따른 보험수요 감소 등 전방위적으로 경영환경이 악화되고 있다""며 ""이런 위기를 극복하고 미래를 향한 도전과 지속적인 성장 기반을 마련하기 위한 대응방안이 필요하다""고 밝혔다
정 회장은 포스트 코로나 시대 위기극복을 위한 과제로 ▲헬스케어사업 영위 기반 마련 등 미래성장동력 확보 ▲디지털 혁신 지원을 통한 미래변화 선도와 경영효율화 지원 ▲생명보험관련 법령과 제도개선 등 업계 경영여건 개선 ▲ESG 경영문화 확산 등 업계 사회적 책임과 소비자 신뢰제고 추구 등을 꼽았다
먼저 생보사의 공공 보건의료데이터 이용 범위 확대를 추진해 보험가입자의 보험료 절감과 상품, 서비스의 선택권을 확대키로 했다
정 회장은 ""건강보험공단 등 가명처리된 보건의료데이터의 보험사 활용체계를 조속히 협의, 확정하고 금융위와 보건복지부 등 정부, 유관기관과 관계법령 정비를 협의해 나갈 예정""이라며 ""상반기 중 국회, 유관기관과의 연계 세미나, 토론회 등을 통해 생보사의 공공 보건의료 데이터 이용의 필요성에 대한 공감대를 확신시킬 계획""이라고 강조했다
특히 미국 등 선진국의 경우 이미 헬스케어가 상품화되고 있지만 국내는 비의료행위 제한 등 엄격한 규제가 상존해 활성화가 어렵다고 지적했다
그는 ""건강관리기기 금액한도 확대 등 건강증진형 보험상품 개발 가이드라인 개정을 건의하고 비의료 건강관리 서비스 가이드라인 및 사례집 개정 건의, 민간제공 헬스케어에 대한 보건당국의 인증제 도입 지원 등을 통해 헬스케어 서비스 사업 영위를 위한 기반 마련을 추진할 것""이라고 말했다
보험산업의 디지털 혁신과 관련해선 ""올해 모바일 청약절차 도입과 절차 간소화, 보험상담에 AI 기술 접목과 활용 확대, 화상앱을 활용한 비대면 영업 확대 등을 추진할 계획""이라고 전했다
이밖에도 정 회장은 보험관련 법규의 개선과 정비가 필요하다고 강조하며 실손의료보험 청구 간소화 도입, 데이터3법 후속 제도개선, 보험사기방지 특별법 개정, 금융소비자보호법 개정 등을 추진한다는 계획이다
2023년 시행 예정인 국제회계기준(IFRS17) 도입과 관련해서도 ""금융당국과 협업해 제도 연착륙을 지원하겠다""고 강조했다
장슬기기자 jsk9831@wowtv
co
kr▶ 네이버 홈에서 [한국경제TV] 채널 구독하기 [생방송보기]▶ 대한민국 재테크 총집결! - [증권 / 주식상담 / 부동산]ⓒ 한국경제TV, 무단 전재 및 재배포 금지	"	https://news.naver.com/main/read.nhn?mode=LSD&mid=sec&sid1=101&oid=215&aid=0000933127	2021-01-29
보험업계	"정희수 생명보험협회장 ""헬스케어·개인연금 상품으로 업계 위기 돌파"""	"”정희수 생명보험협회장(사진)은 28일 업무계획을 통해 헬스케어(건강관리) 서비스와 개인연금 상품 등을 중심으로 업계 성장동력 확보에 집중하겠다고 밝혔다
정 회장은 “현재 연간 700만원 한도인 연금보험(개인연금+퇴직연금) 세제 혜택을 늘리고, 2023년 시행되는 신지급여력제도(K-ICS)를 단계적으로 적용하는 방안 등을 정부에 건의하겠다”고 했다
 정 회장은 “개인정보보호법 개정으로 연구 목적의 가명정보 활용이 가능해졌지만 보험사에는 보건의료 가명정보가 개방되지 않고 있다”며 “당국과 협의체를 구성해 협력 방안을 논의하겠다”고 했다"	"“생명보험업계는 과거 어느 때보다 심각하고 어려운 상황입니다
 경영 위기 타개에 뼈를 깎는 자세로 노력하겠습니다
”정희수 생명보험협회장(사진)은 28일 업무계획을 통해 헬스케어(건강관리) 서비스와 개인연금 상품 등을 중심으로 업계 성장동력 확보에 집중하겠다고 밝혔다
협회는 우선 추진과제로 건강보험 가명정보 활용을 꼽았다
 정 회장은 “개인정보보호법 개정으로 연구 목적의 가명정보 활용이 가능해졌지만 보험사에는 보건의료 가명정보가 개방되지 않고 있다”며 “당국과 협의체를 구성해 협력 방안을 논의하겠다”고 했다
 보험사가 제공할 수 있는 헬스케어 서비스의 범위를 넓히고 건강관리기기 무상 제공 한도(현행 10만원)를 올리는 방안도 추진하기로 했다
정 회장은 “현재 연간 700만원 한도인 연금보험(개인연금+퇴직연금) 세제 혜택을 늘리고, 2023년 시행되는 신지급여력제도(K-ICS)를 단계적으로 적용하는 방안 등을 정부에 건의하겠다”고 했다
임현우 기자 tardis@hankyung
com▶ 경제지 네이버 구독 첫 400만, 한국경제 받아보세요▶ 한경 고품격 뉴스레터, 원클릭으로 구독하세요▶ 한국경제신문과 WSJ, 모바일한경으로 보세요 ⓒ 한국경제 & hankyung
com, 무단전재 및 재배포 금지	"	https://news.naver.com/main/read.nhn?mode=LSD&mid=sec&sid1=101&oid=015&aid=0004491259	2021-01-29
보험업계	보험업계, 제4세대 실손보험의 보험료 인하 효과 '예의주시'	" 이에 따라 새로운 실손의료보험이 적용된 보험상품이 오는 7월 예정대로 출시될 전망이다
보험업계는 실손보험으로 인한 누적 적자액을 해결하는 대책이 포함돼 있지 않아 조금 아쉽다면서도 제3세대 착한 실손보험보다 합리적인 수준으로 결정된 제4세대 실손보험을 대체로 반기고 있다
 보험업계는 제4세대 실손보험의 보험료가 낮아지는 효과가 있어 기존가입자들의 계약전환 등 업계에 미치는 파장을 예의주시하고 있는 분위기다"	"기존 가입자 보험료 부담 늘어…병원 이용 적으면 전환 유리비급여 치료 선호, 병원 자주 이용자 4세대로 이동할지 의문◆…사진=DB새로운 실손의료보험이 적용된 보험상품이 오는 7월 출시된다
 보험업계는 제4세대 실손보험의 보험료가 낮아지는 효과가 있어 기존가입자들의 계약전환 등 업계에 미치는 파장을 예의주시하고 있는 분위기다
28일 금융위원회에 의하면 국민건강보험법 및 보험업법 일부개정안이 다음달 16일까지 입법예고됐다
 이에 따라 새로운 실손의료보험이 적용된 보험상품이 오는 7월 예정대로 출시될 전망이다
실손보험은 2019년 기준 3870만명이 가입할 정도로 인기를 끌고 있으며 국민의 사적 사회 안전망으로서 역할을 수행, 제2의 국민건강보험이라 불리고 있다
 그러나 1999년 최초 출시 당시 자기부담금이 없는 100% 보장 구조 등으로 과다 의료서비스 이용을 유발할 수 있는 구조적 한계점을 지니고 있었다
2017년 착한 실손이라 불린 제3세대 실손보험에서 보장구조를 바꾸는 등 지속적 제도 개선에도 불구하고 대다수 국민의 보험료 부담이 가중되고 보험회사의 손해율이 급격히 상승하는 등 문제점이 지적돼 근본적 개선이 추진된 것이다
개정안에 포함된 제4세대 실손보험의 주요 내용으로는 급여·비급여 분리와 자기부담금 인상을 통한 보험료 인하, 비급여 특약 분리·비급여 보험료 차등제 도입, 재가입 주기(보장 내용 변경 주기)를 기존 15년에서 5년으로 단축 등이 있다
금융위원회 보험과 남명호 사무관은 “규제개혁위원회 심사 후 4월에는 감독 규정 개정을 통해 표준약관 개정되면 7월에는 문제없이 상품이 출시될 것”이라며 “출시에 맞춰 기존 계약자가 새로운 상품으로 전환할 경우를 대비해 쉽게 전환하도록 정책을 마련하는 등 차질없이 준비하겠다”고 말했다
보험업계는 실손보험으로 인한 누적 적자액을 해결하는 대책이 포함돼 있지 않아 조금 아쉽다면서도 제3세대 착한 실손보험보다 합리적인 수준으로 결정된 제4세대 실손보험을 대체로 반기고 있다
 업계는 기존 가입자들이 4세대 실손보험으로 가입 전환을 기대하고 있는 분위기다
 의료서비스 과다 이용자들과 일반 소비자들과의 보험료 형평성 유지를 위해 변경된 제도인 만큼 착한 실손 가입자 뿐 아니라 그 이전 가입자들의 경우도 시간이 지날수록 보험료가 커지기 때문에 4세대로 넘어올 유인이 충분하다는 이유에서다
보험연구원 손해보험연구실 정성희 실장은 “이전 계약자들은 앞으로 보험료가 올라가는 구조다
 1살이 많아질수록 3~4% 상승하며 60~70대가 되면 그보다 더 높아진다”며 “실손보험 보험료의 상당부분이 질병과 관련되어 있으므로 나이가 들수록 보험료 부담은 계속 높아진다
 이 경우 넘어올 유인이 존재한다”고 말했다
또한 병원을 자주 이용하지 않는 사람들에겐 보험료 할인이 매력적이란 의견도 있다
 비급여 의료서비스 이용량과 연계된 보험료 차등제이므로 병원 이용횟수가 적은 대다수의 가입자는 보험료 할인혜택을 볼 수 있기 때문이다
보험업계 관계자는 “의료서비스 이용횟수가 적은 가입자의 경우 착한 실손과 비교해 보험료가 조금 더 저렴해진다”며 “병원에 안가는 사람들에게 할인폭이 더 크게 적용되는 만큼 장점은 충분하다고 생각한다”고 설명했다
반면 기존 가입자들의 이동이 제한적일 것으로 보는 입장도 존재한다
 비급여 치료를 선호하는 이용자나 병원을 자주 가는 가입자들은 장기적으로 손해라고 생각하며 4세대 실손으로 넘어가지 않을 것이란 이유다
 보험업계 관계자는 “코로나19와 건강보험 보장성 강화에도 불구하고 실손 청구와 비급여 증가세가 지속되고 있다”며 “동네 의원의 비급여 치료를 선호하고 의료서비스를 자주 이용하는 가입자들은 전환할 이유가 크지 않아 보인다”고 지적했다
▶ 조세일보 홈페이지 / 정회원 가입▶ 조세일보 네이버 뉴스스탠드 구독(종합/경제)이민재(myfinkl@joseilbo
com)저작권자 ⓒ 조세일보(http://www
joseilbo
com)
 무단전재 및 재배포 금지	"	https://news.naver.com/main/read.nhn?mode=LSD&mid=sec&sid1=004&oid=123&aid=0002239232	2021-01-29
보험+디지털	"정희수 생보협회장 ""디지털 혁신 중점추진"""	"com[서울=뉴시스] 신효령 기자 = 정희수 생명보험협회장은 28일 미래 성장동력 확보, 생보업계의 디지털 혁신, 경영여건 개선 지원 등에 주력하겠다고 밝혔다
 정 회장은 이날 비대면으로 열린 기자간담회에서 ""최근 생명보험업계는 신종 코로나바이러스 감염증(코로나19) 장기화에 따른 대면영업 위축과 함께 세계경제의 불확실성 증대, 국내외 경제성장율 하락 등 사회전반의 경제적 충격이 심화돼 성장이 크게 정체되고 있는 상황""이라며 성장 기반을 마련하기 위한 향후 대응방안을 이같이 발표했다
 정 회장은 ""2023년 시행 예정인 IFRS17은 보험부채를 기존의 원가평가가 아닌 시가로 평가하는 새로운 보험 국제회계기준으로, 보험사의 자본 감소 및 손익변동성이 확대되어 재무부담이 클 것으로 예측된다""고 말했다"	"IFRS17 안정적 도입 위한 제도기반 마련[서울=뉴시스] 생명보험협회 CI
 (사진=생명보험협회 제공) 2021.01.28. photo@newsis
com[서울=뉴시스] 신효령 기자 = 정희수 생명보험협회장은 28일 미래 성장동력 확보, 생보업계의 디지털 혁신, 경영여건 개선 지원 등에 주력하겠다고 밝혔다
 정 회장은 이날 비대면으로 열린 기자간담회에서 ""최근 생명보험업계는 신종 코로나바이러스 감염증(코로나19) 장기화에 따른 대면영업 위축과 함께 세계경제의 불확실성 증대, 국내외 경제성장율 하락 등 사회전반의 경제적 충격이 심화돼 성장이 크게 정체되고 있는 상황""이라며 성장 기반을 마련하기 위한 향후 대응방안을 이같이 발표했다
협회는 신성장동력 확충을 위해 공공 보건의료데이터 이용 확대 지원, 생보업계 헬스케어사업 영위 기반 강화, 연금보험 혜택 확대·선진 연금제도 도입 등을 추진하기로 했다
 헬스케어 서비스 상품화 등 관련 사업 영위를 위한 기반 마련과 관련해 협회는 '건강증진형 보험상품 개발·판매 가이드라인', '비의료 건강관리서비스 가이드라인 및 사례집' 등의 개정을 건의할 방침이다
 금융위, 헬스케어산업, 생·손보업계가 공동 참여하는 '보험업권 헬스케어 활성화 TF'를 통해 헬스케어 서비스 확산을 가로막는 규제를 적극 발굴하고 개선방안을 마련할 계획이다
또 협회는 국민들의 연금상품 가입 확대를 위해 현행 개인연금+퇴직연금 합산 700만원 한도인 연금보험의 세제혜택을 확대하는 방안을 검토해 세제당국에 건의할 예정이다
 장기간 가입할수록 많은 혜택을 제공하는 구조로 상품을 개편하고, 해외 선진 연금제도를 벤치마킹해 국내 실정에 맞는 새로운 제도 도입을 추진할 계획이다
디지털 혁신을 위해 보험 모집채널의 비대면·디지털화 추진, 보험심사 분야 디지털 혁신 지원 등을 진행할 방침이다
 아울러 새 국제회계기준(IFRS17)의 안정적 도입을 위한 제도기반 마련, 신지급여력제도(K-ICS) 도입으로 인한 업계의 재무충격 최소화 지원에 힘쓸 예정이다
 정 회장은 ""2023년 시행 예정인 IFRS17은 보험부채를 기존의 원가평가가 아닌 시가로 평가하는 새로운 보험 국제회계기준으로, 보험사의 자본 감소 및 손익변동성이 확대되어 재무부담이 클 것으로 예측된다""고 말했다
☞공감언론 뉴시스 snow@newsis
com▶ 네이버에서 뉴시스 구독하기▶ K-Artprice, 유명 미술작품 가격 공개▶ 뉴시스 빅데이터 MSI 주가시세표 바로가기<ⓒ 공감언론 뉴시스통신사
 무단전재-재배포 금지>	"	https://news.naver.com/main/read.nhn?mode=LSD&mid=sec&sid1=101&oid=003&aid=0010317704	2021-01-29
보험+디지털	DB손해보험, 모바일 통지서비스 실시	"우편물을 모바일 메시지로 대체DB손해보험은 고객서비스 향상을 위해 '모바일 통지 서비스'를 제공한다고 28일 밝혔다
'모바일 통지 서비스'는 회사가 보유한 고객의 개인식별정보와 통신사의 최신 휴대폰 가입정보를 매칭하여 모바일 메시지로 안내장을 발송하는 서비스로, 우편등기와 달리 타인에게 잘 못 전달되거나 분실가능성을 최소화하여 고객이 개인정보를 철저하게 보호받으면서 언제, 어디서나 제약 없이 안전하게 받아 볼 수 있게 제공되는 서비스다
이처럼 대(對)고객 서비스 디지털 전환 시도는 우편물 발송, 문서 발급, 폐기비용 등을 절감하고 업무처리 속도를 높여 코로나 시대 고객편의를 높였다고 여겨진다"	"우편물을 모바일 메시지로 대체DB손해보험은 고객서비스 향상을 위해 '모바일 통지 서비스'를 제공한다고 28일 밝혔다
'모바일 통지 서비스'는 회사가 보유한 고객의 개인식별정보와 통신사의 최신 휴대폰 가입정보를 매칭하여 모바일 메시지로 안내장을 발송하는 서비스로, 우편등기와 달리 타인에게 잘 못 전달되거나 분실가능성을 최소화하여 고객이 개인정보를 철저하게 보호받으면서 언제, 어디서나 제약 없이 안전하게 받아 볼 수 있게 제공되는 서비스다
이 서비스는 통신 3사의 모든 고객이 별도의 앱 설치 없이 서비스제공에 대한 동의만 하면 제공 받을 수 있고 발송정보는 한국인터넷진흥원(KISA)의 블록체인 유통증명 시스템에 저장되어 유통사실에 대한 법적 효력이 보장된다
 또한 고객의 통지서 조회 사실이 보험사에 즉각 전달되기 때문에 오랜 시간 금융권의 골칫거리로 여겨진 통지서 도달여부 증명에 대한 분쟁을 해결할 것으로 기대된다
 DB 손해보험은 서비스 도입을 위한 시스템 개발을 마치고 장기보험 고객 약 20만명을 대상으로 모바일 통지서 발송을 완료했으며, 이 서비스를 자동차 보험 가입고객 등으로 확대하여 완전한 '종이문서 없는(Paperless)' 업무환경을 조성할 예정이다
이처럼 대(對)고객 서비스 디지털 전환 시도는 우편물 발송, 문서 발급, 폐기비용 등을 절감하고 업무처리 속도를 높여 코로나 시대 고객편의를 높였다고 여겨진다
 뿐만 아니라 다량의 우편물을 모바일 메시지로 대체함으로써 탄소배출량을 줄여 기업의 ESG(Environment, Social, Governance)경영 역량을 강화했다는 평가를 받는다
DB손해보험 관계자는""모바일 통지 서비스 도입을 통해 대고객 서비스를 디지털로 전환하고 향후 빅데이터와 인공지능 등 고객에게 적합한 기술을 적용해 금융권의 디지털 트랜스포메이션을 추진할 것""이라고 말했다
DB손보, 모바일 통지서비스    강민성기자 kms@dt
co
kr 디지털타임스 채널 구독 / 뉴스스탠드 구독디지털타임스 홈페이지 바로가기"	https://news.naver.com/main/read.nhn?mode=LSD&mid=sec&sid1=101&oid=029&aid=0002652119	2021-01-29
