keyword	title	summary	content	url	date
변액보험	메트라이프, AI변액보험 카카오톡에서 펀드 비율 가능	"   이번에 추가된 '노블리치 추천' 서비스는 파운트와 메트라이프생명 노블리치센터가 전 세계 거시경제 및 자산군별 시장 전망과 각 펀드의 수익률, 변동성 및 방어력 등을 종합적으로 분석해 펀드 포트폴리오를 추천해주는 서비스다
   28일 보험업계에 따르면 메트라이프생명은 AL변액보험 펀드관리서비스를 업그레이드해 기존의 'AI추천'부터 '노블리치 추천'까지 폭넓은 모델 포트폴리오를 참고해 변액보험 펀드를 보다 능동적으로 관리할 수 있게 했다
'AI 추천'에 '노블리치 추천'까지 다양한 모델 포트폴리오 참고해 펀드 관리 가능   [파이낸셜뉴스] 메트라이프생명이 인공지능(AI) 변액보험 펀드관리서비스 업그레이드에 나선다"	"'AI 추천'에 '노블리치 추천'까지 다양한 모델 포트폴리오 참고해 펀드 관리 가능   [파이낸셜뉴스] 메트라이프생명이 인공지능(AI) 변액보험 펀드관리서비스 업그레이드에 나선다
 자사 VIP 자산관리 조직인 노블리치 센터의 추천 포트폴리오를 추가했고, 카카오톡에서도 펀드 비율 변경이 가능해진다
   28일 보험업계에 따르면 메트라이프생명은 AL변액보험 펀드관리서비스를 업그레이드해 기존의 'AI추천'부터 '노블리치 추천'까지 폭넓은 모델 포트폴리오를 참고해 변액보험 펀드를 보다 능동적으로 관리할 수 있게 했다
   2003년 업계 최초로 변액유니버셜 보험을 출시한 이후 변액보험의 강자로 자리매김한 메트라이프생명은 지난해 7월 로보어드바이저 전문 투자자문사인 파운트와 협업해 업계 최초로 카카오톡 기반의 AI 펀드관리서비스를 도입했다
   AI 변액보험 펀드관리서비스는 AI 알고리즘을 이용한 투자자문 서비스로, 변액보험 가입자의 투자성향에 맞는 펀드 포트폴리오를 추천한다
 스마트폰으로 '펀드현황 조회'부터 '투자성향별 펀드 포트폴리오 추천 및 변경', 그리고 '리밸런싱(편입비중 재조정)'까지 모든 펀드관리 업무를 처리할 수 있다
   이번에 추가된 '노블리치 추천' 서비스는 파운트와 메트라이프생명 노블리치센터가 전 세계 거시경제 및 자산군별 시장 전망과 각 펀드의 수익률, 변동성 및 방어력 등을 종합적으로 분석해 펀드 포트폴리오를 추천해주는 서비스다
 노블리치센터는 메트라이프생명이 2005년 외국계 보험사 중 최초로 오픈한 고액 자산가 전담 자산관리 센터로, 세무사·감정평가사·국제공인 재무분석사(CFA)·국제공인세무설계사(CFP) 등 세무·부동산·투자·은퇴·보험 분야별 전문가가 중소기업 CEO 등 VIP 고객에게 맞춤 자산 관리 상담을 제공한다
   송영록 메트라이프생명 사장은 ""고객이 다양한 관점에서 제공하는 모델 포트폴리오를 참고하여 펀드를 편리하게 관리하고 보험금의 미래가치를 안정적으로 늘려갈 수 있기를 바란다""고 말했다
  hsk@fnnews
com 홍석근 기자   ▶ 헉! 소리나는 스!토리 뉴스 [헉스]▶ '아는 척'하고 싶은 당신을 위한 [두유노우]▶ 날로먹고 구워먹는 금융이슈 [파인애플]  ※ 저작권자 ⓒ 파이낸셜뉴스
 무단 전재-재배포 금지	"	https://news.naver.com/main/read.nhn?mode=LSD&mid=sec&sid1=101&oid=014&aid=0004573906	2021-01-29
변액보험	변액보험 해지를 생각하는 가입자에게 [삼성생명 보험톡톡]	"		‘해지하면 손해’ 라는 것을 뻔히 알면서도 코로나19로 인한 소득 감소로 어쩔 수 없이 보험 계약을 해지하려는 가입자가 늘고 있다
 만약 장기 유지하고 있는 상품을 해약한다면 비용 측면에서 유리해진 상품을 해지하는 것이고 가입 초기 상품을 해약하게 된다면 비싼 비용을 먼저 부담한 상품을 해지하는 셈이 된다
그럼에도 불구하고 목돈이 필요해 해지를 고려하고 있다면 보험계약대출 등을 활용해 보는 것도 대안이 될 수 있다"	"		‘해지하면 손해’ 라는 것을 뻔히 알면서도 코로나19로 인한 소득 감소로 어쩔 수 없이 보험 계약을 해지하려는 가입자가 늘고 있다
 한편에서는 올들어 코스피 지수가 3000포인트를 넘고 미국 주가지수도 신고가를 갱신하면서 재테크 사이트 등에서는 직접 투자를 하기 위해 변액보험 중도 해지를 고민한다는 글도 증가하고 있다
 예금이나 펀드가 단거리·중거리 금융상품이라면 변액보험은 마라톤과 같다
 단기 수익률을 올리기 위해 해지를 고려한다면 그 전에 변액보험의 가입 목적을 다시 한번 되새겨 볼 필요가 있다
 변액보험도 기본적으로는 보험상품이기 때문에 보장이나 연금 수령 등의 목적을 가지고 있는 상품이다
 보험사는 이러한 목적 달성을 위해 사업비 등의 비용을 주로 보험료 납입기간에 차감한다
 납입이 끝난 시점부터는 비용에 대한 부담이 줄어드는 이유다
 만약 장기 유지하고 있는 상품을 해약한다면 비용 측면에서 유리해진 상품을 해지하는 것이고 가입 초기 상품을 해약하게 된다면 비싼 비용을 먼저 부담한 상품을 해지하는 셈이 된다
 수익률이 문제라고 한다면 변액보험 펀드변경 제도를 활용해 보면 어떨까
 상품에 따라서는 국내외 채권과 주식 등에 대해 다양한 국가와 스타일의 펀드로 변경이 가능하다
 수수료 등의 비용도 들지 않는다
 몇몇 보험사들은 소비자 편의를 위해 기존 상품에 대해서도 최근에 판매되고 있는 펀드들을 추가 선택할 수 있게 했다
 펀드 추천 서비스를 제공하기도 한다
그럼에도 불구하고 목돈이 필요해 해지를 고려하고 있다면 보험계약대출 등을 활용해 보는 것도 대안이 될 수 있다
삼성생명 정행용 보험운영실 프로▶ 경제지 네이버 구독 첫 400만, 한국경제 받아보세요▶ 한경 고품격 뉴스레터, 원클릭으로 구독하세요▶ 한국경제신문과 WSJ, 모바일한경으로 보세요 ⓒ 한국경제 & hankyung
com, 무단전재 및 재배포 금지	"	https://news.naver.com/main/read.nhn?mode=LSD&mid=sec&sid1=101&oid=015&aid=0004491648	2021-01-29
변액보험	박현주 “변액보험 해지말고 투자에 활용을”	"10년 넘으면 투자수익 비과세양극화로 과세 강화되면 유리“채권만 담으려면 하지도 말라”최근 증시 활황으로 변액보험 해지가 늘자 박현주(사진) 미래에셋그룹 회장이 직접 만류하고 나섰다
박 회장은 27일 자사 유튜브 채널 스마트머니에 공개된 ‘연금과 변액보험을 통한 노후 준비편’에서 “변액보험은 비과세 상품으로 저금리 시대 적합한데 고객들은 가입 10년 후 만기가 됐다고, 혹은 수익률이 마이너스라는 이유로 해지하고 있다”면서 “하지만 부의 양극화가 코로나19 이후 심각해지고 있기 때문에 앞으로 세금 부담은 계속 늘 수 밖에 없다는 점을 고려해야 한다”고 주장했다
비과세 혜택까지 고려해 변액보험의 수익률을 생각해야 한다는 취지다"	"10년 넘으면 투자수익 비과세양극화로 과세 강화되면 유리“채권만 담으려면 하지도 말라”최근 증시 활황으로 변액보험 해지가 늘자 박현주(사진) 미래에셋그룹 회장이 직접 만류하고 나섰다
 미래에셋생명은 변액보험을 가장 많이 팔고 있는 보험사다
박 회장은 27일 자사 유튜브 채널 스마트머니에 공개된 ‘연금과 변액보험을 통한 노후 준비편’에서 “변액보험은 비과세 상품으로 저금리 시대 적합한데 고객들은 가입 10년 후 만기가 됐다고, 혹은 수익률이 마이너스라는 이유로 해지하고 있다”면서 “하지만 부의 양극화가 코로나19 이후 심각해지고 있기 때문에 앞으로 세금 부담은 계속 늘 수 밖에 없다는 점을 고려해야 한다”고 주장했다
비과세 혜택까지 고려해 변액보험의 수익률을 생각해야 한다는 취지다
 변액보험은 계약을 10년 이상 유지하면 해외상품에 투자하더라도 세금을 부과하지 않는다
 연금저축펀드나 신탁은 과세이연 효과만 있을 뿐이고, 연금을 수령할 때 연금소득세(3.3~5.5%)도 내야 한다
 박 회장은 “투자에서 중요한 것은 성격이 급하면 안 된다”며 “부자로 살려면 성격이 급한 사람들이 실수하는 경우가 많다”고 꼬집었다
유튜브에 함께 출연한 조성식 미래에셋생명 자산운용부문 대표는 “변액보험은 10년 이상 투자하면 주식 양도차익, 채권 이자, 주식 배당이 모두 비과세 되는 엄청난 비과세 상품”이라며 “우량주 장기투자를 통한 복리효과를 누릴 때 변액보험만큼 효율적인 게 없다”고 거들었다
박 회장은 특히 저금리 시대서 살아남기 위해 연금 내 투자형 상품 비중을 늘려야 한다고 강조했다
 그는 “투자형 자산이 미국은 50%에 육박하는데 우리나라는 퇴직연금 230조원 가운데 11% 정도에 불과해 너무 아쉽다”고 전했다
과거 예금 금리가 5~10%에 달했을 땐 채권과 같은 안전 자산에 넣어도 문제 없었지만 지금과 같은 초저금리 상황에서는 채권투자는 의미가 없다고 평가했다
 그는 “채권형에만 투자하려면 구태여 변액보험에 가입할 이유가 없다”고도 했다
 정경수 기자▶환경적 대화기구 '헤럴드에코'▶밀리터리 전문 콘텐츠 ‘헤밀’▶헤럴드경제 네이버 채널 구독- Copyrights ⓒ 헤럴드경제 & heraldbiz
com, 무단 전재 및 재배포 금지 -	"	https://news.naver.com/main/read.nhn?mode=LSD&mid=sec&sid1=101&oid=016&aid=0001786222	2021-01-29
연금보험	"정희수 생보협회장 ""연금보험 稅혜택 확대 건의"""	"정희수 생보협회장은 28일 서면으로 진행한 취임 기자 간담회에서 “생보 업계는 매우 엄중하고 긴박한 위기 상황”이라며 △미래 성장 동력 확보 △디지털 혁신 지원을 통한 미래 변화 선도 및 경영 효율화 지원 △생보 관련 법령 및 제도 개선 △환경·사회·지배구조(ESG) 경영 문화 확산 등 네 가지 대응 방안을 제시했다
정희수 생보협회장 취임 간담실손 청구 간소화 도입 의지도정희수 생명보험협회장[서울경제] 생명보험협회가 국민들의 연금 상품 가입 확대를 위해 현재 700만 원 한도인 연금보험의 세제 혜택을 확대하는 방안을 추진한다
 정 회장은 “생보사의 공공 보건 의료 데이터 이용 범위가 확대되면 보험 가입자의 보험료 절감, 상품·서비스의 선택권 확대, 유병자·고령자 대상 보험 시장 확대 등을 기대할 수 있다”며 “이를 위해 국민건강보험공단·건강보험심사평가원의 가명 처리된 보건 의료 데이터의 보험사 활용 체계를 협의하고 당국 및 유관 기관과 관계 법령 정비를 협의할 것”이라고 말했다"	"정희수 생보협회장 취임 간담실손 청구 간소화 도입 의지도정희수 생명보험협회장[서울경제] 생명보험협회가 국민들의 연금 상품 가입 확대를 위해 현재 700만 원 한도인 연금보험의 세제 혜택을 확대하는 방안을 추진한다
 또 가입자만 약 3,800만 명에 달하는 ‘제2의 건강보험’인 실손의료보험 청구 간소화 도입을 위해 관련 보험업법 개정에도 힘을 쏟는다
정희수 생보협회장은 28일 서면으로 진행한 취임 기자 간담회에서 “생보 업계는 매우 엄중하고 긴박한 위기 상황”이라며 △미래 성장 동력 확보 △디지털 혁신 지원을 통한 미래 변화 선도 및 경영 효율화 지원 △생보 관련 법령 및 제도 개선 △환경·사회·지배구조(ESG) 경영 문화 확산 등 네 가지 대응 방안을 제시했다
우선 현행 개인연금과 퇴직연금을 합산해 700만 원 한도인 연금보험의 세제 혜택을 확대하는 방안을 검토해 세제 당국에 건의할 계획이다
 지난 2018년 기준 국내 사적연금 가입률은 16.9%로, 경제협력개발기구(OECD) 평균(67.5%)보다 낮다
 퇴직연금 수급 방식도 일시금 수령에 집중돼 있는데다 연금보험 상품의 수령기간도 6.4년에 불과하다
 정 회장은 “세제 혜택 확대와 함께 장기간 가입할수록 많은 혜택을 제공하는 구조로 상품을 개편하고 해외 선진 연금제도를 벤치마킹해 새로운 제도를 도입할 것”이라고 설명했다
이와 함께 생보사의 공공 보건 의료 데이터 이용 범위 확대를 추진하는 한편 ‘보험업권 헬스케어 활성화 태스크포스(TF)’를 통해 헬스케어 서비스 확산을 위한 개선 방안을 마련하기로 했다
 정 회장은 “생보사의 공공 보건 의료 데이터 이용 범위가 확대되면 보험 가입자의 보험료 절감, 상품·서비스의 선택권 확대, 유병자·고령자 대상 보험 시장 확대 등을 기대할 수 있다”며 “이를 위해 국민건강보험공단·건강보험심사평가원의 가명 처리된 보건 의료 데이터의 보험사 활용 체계를 협의하고 당국 및 유관 기관과 관계 법령 정비를 협의할 것”이라고 말했다
아울러 생보 업계의 경영 여건 개선을 위해 보험 관련 법령 개정도 추진하겠다는 구상이다
 2016년 최초 논의된 후 답보 상태에 빠진 실손의료보험 청구 간소화를 비롯해 데이터 3법 개정 이후 후속 제도 개선에도 속도가 붙도록 당국과 국회에 건의할 방침이다
 또 오는 2023년 시행 예정인 IFRS17과 신지급여력제도(K-ICS) 도입에도 대비해 관련 제도가 안정적으로 연착륙할 수 있도록 지원할 예정이다
금융권 내 디지털 전환 추세에 따라 보험 모집 채널과 심사 분야에서의 비대면·디지털화에도 집중한다
 또 전 세계적으로 확산 중인 ESG 경영 문화에도 적극 동참하기 위해 다음 달 중 보험 업계 최고경영자(CEO)가 참여하는 ‘ESG 경영 공동 선포식’도 연다
/이지윤 기자 lucy@sedaily
com▶ 상위 1% 투자자 픽! [주식 초고수는 지금]▶ 전문가에게 듣는 성공 방정식 [투자의 창]▶ 네이버 채널에서 '서울경제' 구독해주세요!저작권자 ⓒ 서울경제, 무단 전재 및 재배포 금지	"	https://news.naver.com/main/read.nhn?mode=LSD&mid=sec&sid1=101&oid=011&aid=0003864217	2021-01-29
연금보험	"정희수 생명보험협회장 ""헬스케어·개인연금 상품으로 업계 위기 돌파"""	"”정희수 생명보험협회장(사진)은 28일 업무계획을 통해 헬스케어(건강관리) 서비스와 개인연금 상품 등을 중심으로 업계 성장동력 확보에 집중하겠다고 밝혔다
정 회장은 “현재 연간 700만원 한도인 연금보험(개인연금+퇴직연금) 세제 혜택을 늘리고, 2023년 시행되는 신지급여력제도(K-ICS)를 단계적으로 적용하는 방안 등을 정부에 건의하겠다”고 했다
 정 회장은 “개인정보보호법 개정으로 연구 목적의 가명정보 활용이 가능해졌지만 보험사에는 보건의료 가명정보가 개방되지 않고 있다”며 “당국과 협의체를 구성해 협력 방안을 논의하겠다”고 했다"	"“생명보험업계는 과거 어느 때보다 심각하고 어려운 상황입니다
 경영 위기 타개에 뼈를 깎는 자세로 노력하겠습니다
”정희수 생명보험협회장(사진)은 28일 업무계획을 통해 헬스케어(건강관리) 서비스와 개인연금 상품 등을 중심으로 업계 성장동력 확보에 집중하겠다고 밝혔다
협회는 우선 추진과제로 건강보험 가명정보 활용을 꼽았다
 정 회장은 “개인정보보호법 개정으로 연구 목적의 가명정보 활용이 가능해졌지만 보험사에는 보건의료 가명정보가 개방되지 않고 있다”며 “당국과 협의체를 구성해 협력 방안을 논의하겠다”고 했다
 보험사가 제공할 수 있는 헬스케어 서비스의 범위를 넓히고 건강관리기기 무상 제공 한도(현행 10만원)를 올리는 방안도 추진하기로 했다
정 회장은 “현재 연간 700만원 한도인 연금보험(개인연금+퇴직연금) 세제 혜택을 늘리고, 2023년 시행되는 신지급여력제도(K-ICS)를 단계적으로 적용하는 방안 등을 정부에 건의하겠다”고 했다
임현우 기자 tardis@hankyung
com▶ 경제지 네이버 구독 첫 400만, 한국경제 받아보세요▶ 한경 고품격 뉴스레터, 원클릭으로 구독하세요▶ 한국경제신문과 WSJ, 모바일한경으로 보세요 ⓒ 한국경제 & hankyung
com, 무단전재 및 재배포 금지	"	https://news.naver.com/main/read.nhn?mode=LSD&mid=sec&sid1=101&oid=015&aid=0004491259	2021-01-29
금융+보험	보험료 부담 10% 낮춘 대리기사 전용 온라인 보험 나온다	"		대리기사 보험료 부담을 줄인 CM(온라인) 전용 개인보험 상품이 출시된다
금융위원회와 금융감독원은 28일 이 같은 내용을 골자로 하는 '필수노동자인 대리기사의 보험료 부담 완화 방안'을 마련해 추진한다고 발표했다
 대리운전업체가 보험사로부터 단체보험 모집수수료를 받거나, 실제 보험료 보다 많은 보험료를 수취해 단체보험을 강제할 유인이 있다는 지적에 따른 조치다"	"		대리기사 보험료 부담을 줄인 CM(온라인) 전용 개인보험 상품이 출시된다
 대리운전업체가 대리기사 개인보험 가입 여부를 실시간 확인해 보험에 중복 가입하는 사례를 예방하는 조회시스템도 상용화한다
금융위원회와 금융감독원은 28일 이 같은 내용을 골자로 하는 '필수노동자인 대리기사의 보험료 부담 완화 방안'을 마련해 추진한다고 발표했다
 이는 금융위 올해 업무계획 중 하나인 보험의 사적 안전망 기능 강화 후속 조치다
현재 10만명 대리기사와 4000개 수준 대리운전업체가 영업하고 있다
 하지만 대리기사가 개인보험에 가입하더라도 이 사실을 업체가 확인할 수 없어 복수 단체보험에 가입하는 등 불필요한 비용이 발생하고 있다
 게다가 대리기사를 위한 개인보험이 존재하지만, 보험료가 높아 전체 대리운전보험 중 7%(2020년 말 기준)에 수준에 불과하다
우선 금융당국은 대리기사를 위한 온라인 개인보험을 판매하기로 했다
 이 상품은 오프라인 모집수수료 등 사업비를 절감한 온라인 전용 상품으로, 종전 대비 10% 보험료 부담이 적은 것이 특징이다
29일 KB손해보험가 판매를 시작하며 3월 중 DB손해보험도 대리기사를 위한 온라인 전용 개인보험을 선보일 예정이다
 KB손보의 경우 종전 113만원이던 보험료가 96만원(15%↓)으로, DB손보는 114만원에서 100만원(12%↓)으로 보험료가 각각 줄어든다
금융당국은 또 대리운전 개인보험에도 보험료 할인·할증제도를 도입하기로 했다
 대리기사의 안전운전을 유도하는 한편 이들의 보험료 부담을 완화하기 위한 조치다
대리기사 보험 가입 여부를 실시간 확인하는 '대리운전 개인보험 가입조회시스템'도 오픈한다
개인보험에 가입한 대리기사가 조회시스템에 접속해 본인 개인정보 입력·정보활용 동의를 거치면 대리업체가 보험가입 여부를 확인한 이후에 대리콜을 배정하는 구조다
대리운전 시스템업체 중 콜마너를 이용하는 대리업체·기사는 29일부터 시스템에 접속해 개인정보를 등록할 수 있으며 대리콜은 2월 5일부터 가능하다
 로지(바나플), 아이콘소프트, 카카오모빌리티 등 다른 업체들은 2~3월 중 전산연결을 거쳐 서비스한다
대리운전업체의 불공정거래행위에 대한 관리·감독도 강화하기로 했다
 대리운전업체가 보험사로부터 단체보험 모집수수료를 받거나, 실제 보험료 보다 많은 보험료를 수취해 단체보험을 강제할 유인이 있다는 지적에 따른 조치다
금융위 관계자는 “대리운전보험 중복가입 문제 해소를 통해 특수형태근로종사자인 대리기사 보험료 부담이 크게 완화될 수 있을 것으로 기대한다”면서 “대리운전보험 보장사각지대 해소는 물론 질 높은 서비스 환경이 조성될 것”이라고 말했다
박윤호기자 yuno@etnews
com▶ ""K-시큐리티 서밋 2021"" 1월 29일 온라인 생중계▶ 네이버 홈에서 [전자신문] 구독하기 [Copyright ⓒ 전자신문 & 전자신문인터넷, 무단전재 및 재배포 금지]"	https://news.naver.com/main/read.nhn?mode=LSD&mid=sec&sid1=101&oid=030&aid=0002925825	2021-01-29
금융+보험	KB손해보험 다이렉트, ‘주택화재보험’ 매출 증가	" 사진=KB손해보험 제공KB손해보험이 겨울철 잇따른 화재사고로 인해 주택화재보험에 대한 필요성이 강조되면서 KB손해보험 다이렉트 주택화재보험의 매출건수가 급증하고 있다고 29일 밝혔다
KB손해보험 다이렉트 주택화재보험은 아파트뿐만 아니라 연립 및 단독주택도 가입이 가능하며 내집이 아닌 전/월세도 거주기간에 맞춰 가입을 할 수 있다
KB손보는 최근 코로나19로 인한 생활 속 거리두기가 지속되면서 집안에서의 활동시간이 더욱 늘어나고 있는 상황을 감안하면 화재사고 발생확률은 더욱 높아질 것으로 예상되나 여전히 주택화재보험의 가입율은 낮은 편이라고 지적했다"	"◆…KB손해보험 다이렉트 주택화재보험의 매출건수가 급증하고 있다
 사진=KB손해보험 제공KB손해보험이 겨울철 잇따른 화재사고로 인해 주택화재보험에 대한 필요성이 강조되면서 KB손해보험 다이렉트 주택화재보험의 매출건수가 급증하고 있다고 29일 밝혔다
KB손보는 지난해 4분기 울산아파트화재, 군포아파트화재 등 대형 화재 사고가 잇따른 가운데 KB손보 다이렉트 주택화재보험의 가입건수는 2019년 4분기 대비 2020년 4분기에 9배에 달하는 증가세를 보였다고 설명했다
KB손보는 최근 코로나19로 인한 생활 속 거리두기가 지속되면서 집안에서의 활동시간이 더욱 늘어나고 있는 상황을 감안하면 화재사고 발생확률은 더욱 높아질 것으로 예상되나 여전히 주택화재보험의 가입율은 낮은 편이라고 지적했다
소방청에 의하면 전체 화재사고 중 주택화재 발생 건수는 매년 1만건 이상 증가하고 있으며 이러한 주택화재의 주요 원인은 부주의로 인해 발생한다
 따라서 주택화재보험 가입을 통한 든든한 대비가 필요할 것으로 보인다
아파트 거주자의 경우 대부분 관리비로 보험료가 부가되는 방식의 단체화재보험에 가입은 되어 있으나 아파트 단체화재보험은 보장금액이 충분하지 않은 경우가 많아 폭넓은 보장을 받을 수 있는 별도의 주택화재보험 가입을 고려해 볼 필요가 있다
KB손해보험 다이렉트 주택화재보험은 아파트뿐만 아니라 연립 및 단독주택도 가입이 가능하며 내집이 아닌 전/월세도 거주기간에 맞춰 가입을 할 수 있다
또한 화재사고로 인한 직접적인 재산 피해뿐만 아니라 우리집에서 발생한 화재로 이웃집에 피해가 발생해 형법 제 171조에 따른 화재사고 벌금형 확정판결을 받았을 경우 화재벌금비용, 임시 거주비, 누수 피해, 12대 가전제품 수리비 등 폭넓은 보장을 받을 수 있다
한편 손쉽고 간편한 혁신적인 가입 프로세스도 눈에 띈다
 이름, 전화번호 등을 입력하지 않아도 모바일로 1분 안에 보험료를 계산해 볼 수 있으며 별도의 번거로운 과정 없이 꼭 필요한 보장만 선별하여 간편하게 가입이 가능하게 하는 등 고객 편의성도 대폭 향상됐다
KB손해보험 다이렉트본부장 김성범 상무는 “앞으로도 KB금융의 체계적인 부동산 통합관리 시스템 등을 활용하여 최상의 보험상품과 서비스를 제공할 수 있도록 노력하겠다”고 말했다
▶ 조세일보 홈페이지 / 정회원 가입▶ 조세일보 네이버 뉴스스탠드 구독(종합/경제)이민재(myfinkl@joseilbo
com)저작권자 ⓒ 조세일보(http://www
joseilbo
com)
 무단전재 및 재배포 금지	"	https://news.naver.com/main/read.nhn?mode=LSD&mid=sec&sid1=004&oid=123&aid=0002239297	2021-01-29
